作者,作者身分,"文獻名稱	",年份,施引文獻,連結,摘要,作者,索引關鍵字,EID
"Mathieu C., Overbergh L., Badenhoop K., Bingley P.J., Dayan C.M., Demengeot J., Dotta F., Eizirik D.L., Lenzen S., Marchetti P., Peakman M., Roep B.O., Todd J., Rottiers P., Megit S., On behalf of the NAIMIT consortium",16463757000;7003372526;7004943925;7005507784;55161416500;6603702602;7004814994;7101723318;7005352936;7103204997;7005867806;7005566787;7402060033;6602219471;56468041000;,The story of NAIMIT - A framework 7 project on type 1 diabetes,2014,,https://www.scopus.com/inward/record.uri?eid=2-s2.0-84920275834&doi=10.17925%2fEE.2014.10.02.100&partnerID=40&md5=4b35dca08380ee96b06a0aadabe86f6c,"NAIMIT (acronym for Natural Immune Modulation for Intervention in Type 1 Diabetes) is a large-scale collaborative programme of the 7th framework from the European Commission. The aim of the consortium is to bring together a group of leading European researchers spanning the field from genetics, through pancreatic beta-cell, dendritic cells and T-cell biology, towards clinical interventions. The ultimate goal is to develop novel and personalised interventional therapies in recent-onset type 1 diabetic patients, with minimal immune system interference, leading to beta-cell protection and restoration, based on a solid understanding of the disease pathogenesis, enabling experimental findings to be adopted for clinical applications. ? TOUCH MEDICAL MEDIA 2014.",Intervention; Personalised therapies; Type 1 diabetes,autoantigen; gamma interferon; glucocorticoid; interleukin 1beta; probiotic agent; retinoic acid; steroid; T lymphocyte receptor; vitamin D; adoptive transfer; antigen presenting cell; Article; autoimmunity; cell protection; dendritic cell; diabetic patient; genetic marker; good manufacturing practice; human; immune system; immunocompetent cell; immunological tolerance; immunomodulation; immunosuppressive treatment; insulin dependent diabetes mellitus; insulin treatment; intervention study; intestine lymphatic tissue; lifestyle modification; nonhuman; pancreas islet beta cell; personalized medicine; pharmacogenetics; phenotype; regulatory T lymphocyte; RNA sequence,2-s2.0-84920275834
"Mustafa O.G., Choudhary P.",55879657400;25951256500;,Hypoglycaemia in hospital: A preventable killer?,2014,,https://www.scopus.com/inward/record.uri?eid=2-s2.0-84920177079&doi=10.1111%2fdme.12541&partnerID=40&md5=5915c156fe130b640f917d99fb373244,[無可用摘要],,glucose; insulin; antidiabetic agent; insulin; blood glucose monitoring; diabetes mellitus; Editorial; hospital; human; hyperkalemia; hypoglycemia; insulin infusion; length of stay; medical error; microscopy; mortality; patient safety; prescription; Brain Diseases; heart arrest; hypoglycemia; iatrogenic disease; pathophysiology; Seizures; Brain Diseases; Heart Arrest; Humans; Hypoglycemia; Hypoglycemic Agents; Iatrogenic Disease; Insulin; Seizures,2-s2.0-84920177079
Goadsby P.J.,35476589900;,Hemicrania continua- Major Shortcomings in the new classification or rigid thinking is death to progress,2014,,https://www.scopus.com/inward/record.uri?eid=2-s2.0-84919933716&doi=10.1186%2f1129-2377-15-53&partnerID=40&md5=e1d1beff6aef316f8f214baa76f750f5,[無可用摘要],,"indometacin; placebo; indometacin; nonsteroid antiinflammatory agent; drug exposure; hemicrania continua; human; International Classification of Diseases; International Classification of Headache Disorders III beta; Letter; neurologic examination; patient assessment; phenotype; treatment response; classification; Headache Disorders; Anti-Inflammatory Agents, Non-Steroidal; Headache Disorders; Humans; Indomethacin",2-s2.0-84919933716
Cohen A.,55465458700;,A vascular physician's view of venous thromboembolism and apixaban,2014,,https://www.scopus.com/inward/record.uri?eid=2-s2.0-84919794320&doi=10.2217%2ffca.14.66&partnerID=40&md5=26b7e136961b4ab0936ab80da4f0fea3,"Dr Cohen is a vascular physician and epidemiologist involved in clinical work, designing, managing and analyzing clinical trials from Phase I to IV. He is the Chairman and member of many international steering committees for multicenter trials, and epidemiological and pharmaco-economic studies. Dr Cohen graduated with honors in Medicine and Surgery from the University of Melbourne, Australia (MBBS). He achieved his fellow of the Royal Australasian College of Physicians (FRACP) in 1990, and received an MSc in Epidemiology in 1991 from the University of London. His MSc thesis in 1991 was on the Metabolic Syndrome in South Asia. In 1998, he achieved MD with a thesis on Epidemiology of VTE and Thromboprophylaxis. He has written or co-authored over 300 publications since 1990, including 40 publications in The Lancet and New England Journal of Medicine. ? 2014 Future Medicine Ltd.",,acetylsalicylic acid; antivitamin K; apixaban; dabigatran; enoxaparin; fluconazole; heparin; low molecular weight heparin; placebo; ritonavir; rivaroxaban; warfarin; apixaban; blood clotting factor 10a inhibitor; pyrazole derivative; pyridone derivative; anticoagulant therapy; bleeding; cardiac patient; cardiologist; career; deep vein thrombosis; drug safety; heart atrium fibrillation; human; hypercholesterolemia; left atrial appendage closure device; lung embolism; patient monitoring; phase 3 clinical trial (topic); preventive medicine; recurrent disease; Review; vein thrombosis; venous thromboembolism; interview; treatment outcome; venous thromboembolism; Factor Xa Inhibitors; Humans; Pyrazoles; Pyridones; Treatment Outcome; Venous Thromboembolism,2-s2.0-84919794320
"Almeida T.F., Soares D.C., Quaio C.R., Honjo R.S., Bertola D.R., McGrath J.A., Kim C.A.",55990392000;56410532500;55402946000;25925881400;55956028800;7402677631;54793146100;,Lipoid proteinosis: Rare case confirmed by ECM1 mutation detection,2014,1,https://www.scopus.com/inward/record.uri?eid=2-s2.0-84919596970&doi=10.1016%2fj.ijporl.2014.09.025&partnerID=40&md5=7e7f09554d92dd7673904c7d684cc6ba,[無可用摘要],,scleroprotein; adolescent; Article; blister; case report; clinical feature; disease course; ECM1 gene; female; gene amplification; gene mutation; hippocampus; histopathology; hoarseness; human; human tissue; lipoid proteinosis; parahippocampal gyrus; polymerase chain reaction; pruritus; rash,2-s2.0-84919596970
"Cohen A., Gayer-Anderson C., Abas M., De Silva M.",7404780251;55334743900;7004595649;9735489500;,Teaching global mental health at home and abroad,2014,,https://www.scopus.com/inward/record.uri?eid=2-s2.0-84919420577&doi=10.1016%2fS2215-0366%2814%2900066-2&partnerID=40&md5=45627e6023c5876c09b9e740a6e6ef40,[無可用摘要],,anthropology; causal attribution; funding; health care policy; home; human; Letter; lowest income group; medical education; mental disease; mental health; psychiatry; public health; traditional medicine,2-s2.0-84919420577
"Ashworth M., White P., Armstrong D.",7005599508;35587016600;35572674800;,Out of Hours: Dangerous Ideas: Resistant superbugs and the potential of the microbiome,2014,,https://www.scopus.com/inward/record.uri?eid=2-s2.0-84919389679&doi=10.3399%2fbjgp14X682921&partnerID=40&md5=99ee7024b54b31cc1db6d5f4360da1b7,[無可用摘要],,"antibiotic agent; probiotic agent; antiinfective agent; antibiotic resistance; bacterial infection; Clostridium difficile infection; consultation; general practice; human; metabolic syndrome X; microbiome; Note; obesity; prescription; primary medical care; skin infection; urinary tract infection; antibiotic resistance; Community-Acquired Infections; drug effects; health care planning; microflora; molecular evolution; Anti-Bacterial Agents; Community-Acquired Infections; Drug Resistance, Microbial; Evolution, Molecular; Health Priorities; Humans; Microbiota",2-s2.0-84919389679
"Jos? R.J., Dickey B.F., Brown J.S.",56304528100;7006972883;35553480100;,Non-infectious respiratory disease in non-HIV immunocompromised patients,2014,1,https://www.scopus.com/inward/record.uri?eid=2-s2.0-84916612005&doi=10.12968%2fhmed.2014.75.12.691&partnerID=40&md5=1d8875a162b502e8059e7852b586f85b,This review summarizes current knowledge regarding frequently encountered non-infectious respiratory complications in adult immunocompromised hosts (excluding those with human immunodeficiency virus (HIV) infection). In particular it will discuss complications of transplantation and of primary immunodeficiencies. ? 2014 MA Healthcare Ltd.,,adult; complication; graft versus host reaction; human; immune deficiency; immunocompromised patient; immunology; Respiratory Tract Diseases; transplantation; Adult; Graft vs Host Disease; Humans; Immunocompromised Host; Immunologic Deficiency Syndromes; Respiratory Tract Diseases; Transplantation,2-s2.0-84916612005
"Jos? R.J., Dickey B.F., Brown J.S.",56304528100;7006972883;35553480100;,Infectious respiratory disease in non-HIV immunocompromised patients,2014,,https://www.scopus.com/inward/record.uri?eid=2-s2.0-84916605151&doi=10.12968%2fhmed.2014.75.12.685&partnerID=40&md5=1bef9c8101f0fd57352d02c02f6fb36e,"This review summarizes current knowledge regarding frequently encountered infectious respiratory complications in adult immunocompromised hosts (excluding those with human immunodeficiency virus (HIV) infection). It discusses the clinical approach to these patients, the usual patterns of disease and the most important pathogens. ? 2014 MA Healthcare Ltd.",,adult; human; immunocompromised patient; microbiology; Opportunistic Infections; Respiratory Tract Infections; Adult; Humans; Immunocompromised Host; Opportunistic Infections; Respiratory Tract Infections,2-s2.0-84916605151
"Green J., Biehal N., Roberts C., Dixon J., Kay C., Parry E., Rothwell J., Roby A., Kapadia D., Scott S., Sinclair I.",55161737900;6507568304;35474924800;14031483800;55523806200;56998338800;17343192000;24381968900;41461625200;7401505816;16481285200;,Authors' reply,2014,1,https://www.scopus.com/inward/record.uri?eid=2-s2.0-84916593240&doi=10.1192%2fbjp.205.6.498b&partnerID=40&md5=549a181e95c7c371da016fc216b621dd,[無可用摘要],,foster care; high risk population; human; justice; juvenile delinquency; Letter; sample size; adolescent behavior; educational status; female; male; mental health; psychology; Adolescent Behavior; Educational Status; Female; Foster Home Care; Humans; Juvenile Delinquency; Male; Mental Health,2-s2.0-84916593240
Wainwright L.,14039756200;,Using placements to teach on children's development,2014,1,https://www.scopus.com/inward/record.uri?eid=2-s2.0-84916242228&partnerID=40&md5=ab1249ba02020030a242afb9f7c1324d,"Student children's nurses have limited opportunities to gain practical knowledge in normal child development. An initiative involving local non-healthcare organisations that provide care and education to the under-fives was introduced at a London university. This allowed student children's nurses to gain practical experience in meeting the needs of the well child, and to understand normal developmental milestones. Feedback from students and the organisations involved showed positive benefit. Plans are under way to extend the initiative to older children and young people.",,"child; child development; feedback system; human; nursing student; United Kingdom; Child; Child Development; Feedback; Great Britain; Humans; Students, Nursing",2-s2.0-84916242228
du Toit G.,7004416850;,Research on peanut allergy in children,2014,,https://www.scopus.com/inward/record.uri?eid=2-s2.0-84915753937&partnerID=40&md5=739813ebf0df8efb02c78c7d0504796e,"I was privileged to complete my sub-specialist training in Paediatric Allergy under the tutorship of Professors Eugene Weinberg, Cassim Motala and Paul Potter. These three mentors were directly responsible for initiating my research interest in the niche of food allergy. Peanut Allergy (PA) was then, in the year 2000, an exceptionally rare diagnosis among black South African children (even in a Tertiary Hospital Setting). Intriguingly however, the rates of PA were noted to be higher among mixed-race South African (SA) children and higher yet among Caucasian SA children ? 2014, Allergy Society of South Africa. All Rights Reserved.",,arachis oil; child; disease association; eczema; environmental exposure; ethnic difference; food intake; high risk infant; human; Israel; Jew; peanut allergy; prevalence; prick test; Review; risk factor; South Africa; United Kingdom,2-s2.0-84915753937
"Joly L., Cornes M., Manthorpe J.",55877648800;22333783900;7006601649;,Supporting the social networks of homeless people,2014,1,https://www.scopus.com/inward/record.uri?eid=2-s2.0-84914666076&doi=10.1108%2fHCS-06-2014-0014&partnerID=40&md5=049556bb0f8b57051177f4c71e1b680a,"Purpose - Homelessness often results from the loss of social networks and individuals are tested in being able to sustain or develop new positive social networks necessary to rebuild lives. The purpose of this paper is to present findings from an exploratory study which investigated how different agencies and professionals support people experiencing multiple exclusion homelessness (MEH) to develop and maintain their social networks amid other competing priorities, such as reducing substance misuse and re-offending.Design/methodology/approach - The study was undertaken in England 2010-2011 in three case study sites. Data were collected in 76 interviews with practitioners and managers, from disciplines including housing support, social work, criminal justice, mental health and substance misuse services. Totally, 56 interviews and five focus groups were also undertaken with people with experiences of MEH. Data were analysed thematically. Data from one site in particular permitted a focus on personal relationships and social networks which were seen as beneficial but also potentially problematic. These data are drawn upon to reflect on the implications for housing providers and practitioners.Findings - While multiple factors had often led to the loss of social networks among homeless people, findings revealed that practitioners working with homeless people may be able to promote existing social networks, such as partnerships, help develop new ones, and support people withdrawing from less positive relationships. The authors conclude that practitioners should be alert to structural changes that threaten social networks and may need to enhance skills in creating opportunities to foster existing positive relationships in direct work with their clients and in collaboration with other professionals. The need to be careful of blurring professional boundaries is also observed.Practical implications - This paper suggests approaches that may encourage practitioner reflection and commissioning practice in achieving good outcomes for people with experiences of MEH by highlighting the importance of social networks and the potential for practitioners to foster supportive relationships.Originality/value - This paper considers the often under-researched area of day-to-day engagement with social networks and the implications of working to support these as part of the role of homelessness services. While drawing primarily on recent research in England the themes raised will have wider relevance to housing and care services generally. ? Emerald Group Publishing Limited, ISSN 1460-8790.",Couples; Homelessness; Practice; Relationships; Social networks; Support,,2-s2.0-84914666076
"Filipovi? A., Lombardo Y., Faronato M., Abrahams J., Aboagye E., Nguyen Q.-D., d’Aqua B.B., Ridley A., Green A., Rahka E., Ellis I., Recchi C., Przulj N., Sarajli? A., Alattia J.-R., Fraering P., Deonarain M., Coombes R.C.",55413982900;24537544300;12805984500;24174023400;7004143668;56016234500;56397048900;55944378200;57202862985;57202504209;36039440700;57195537945;6603832221;17435535700;57200185969;6507555026;6701416415;7202546957;,"Erratum: Anti-nicastrin monoclonal antibodies elicit pleiotropic anti-tumour pharmacological effects in invasive breast cancer cells [Breast Cancer Res Treat, DOI 10.1007/s10549-014-3119-z]",2014,1,https://www.scopus.com/inward/record.uri?eid=2-s2.0-84911979608&doi=10.1007%2fs10549-014-3174-5&partnerID=40&md5=7de495d3a16faafdd73250a20b09d674,[無可用摘要],,Erratum; error,2-s2.0-84911979608
"Nijjar S., Laji K., Stone S.",56426106900;24067179400;57198111709;,A woman with familial partial lipodystrophy and the complications of her four pregnancies,2014,,https://www.scopus.com/inward/record.uri?eid=2-s2.0-84911917934&doi=10.1177%2f1753495X13516441&partnerID=40&md5=d80882b51ace55494433d578c7166da4,We discuss a case of a woman ultimately diagnosed with familial partial lipodystrophy following her fourth pregnancy. In her previous pregnancies she had numerous complications thought to be related to diabetes including recurrent macrosomia and polyhydramnios. In her second pregnancy she underwent emergency caesarean section for fetal tachycardia at 34 weeks’ gestation. Her baby was diagnosed with unexplained cerebral ischaemic injury and limb ischaemia requiring amputation. Postnatally she was diagnosed with type 2 diabetes mellitus with subsequent poor control. Very high insulin demands in this fourth pregnancy and an unusual phenotypic appearance in the patient and her mother raised suspicion of an underlying condition. Genetic studies confirmed the clinical diagnosis of familial partial lipodystrophy. ? The Author(s) 2013.,Clinical genetics; diabetes; high-risk pregnancy; maternal-fetal medicine; reproductive endocrinology,glibenclamide; insulin; long acting insulin; metformin; pioglitazone; short acting insulin; steroid; adult; arm malformation; Article; case report; cesarean section; familial partial lipodystrophy; female; fetus disease; fetus echography; fetus lung maturation; first trimester pregnancy; human; hydramnios; hypoglycemia; hypoxic ischemic encephalopathy; infant; injection site; insulin infusion; insulin resistance; limb amputation; limb ischemia; macrosomia; male; metabolic syndrome X; non insulin dependent diabetes mellitus; pregnancy complication; pregnancy diabetes mellitus; pregnancy termination; tachycardia,2-s2.0-84911917934
"Mograbi D., Da Silva J.A.",31767548100;7201732902;,What is new in perception-action and memory-attention,2014,,https://www.scopus.com/inward/record.uri?eid=2-s2.0-84911916862&doi=10.3922%2fj.psns.2014.031&partnerID=40&md5=da00cf131fb16ff17f6a798b27a8b6e9,[無可用摘要],,Alzheimer disease; attention; body equilibrium; Editorial; human; intelligence; knowledge; locomotion; memory; pain assessment; perception; postgraduate student; symposium; undergraduate student; visual system function,2-s2.0-84911916862
"Goonewardene S., Young A., Persad R., Makar A.",18535434600;55723298200;35467356700;7005184008;,Prostate cancer survivorship: A different type of management,2014,,https://www.scopus.com/inward/record.uri?eid=2-s2.0-84911470421&doi=10.1089%2fjomh.2014.0056&partnerID=40&md5=259519e15e4eae97cf204bc383dd8b9f,[無可用摘要],,cancer survival; cancer survivor; cancer therapy; doctor patient relation; follow up; health care system; human; interpersonal communication; Letter; life expectancy; patient care; practice guideline; prostate cancer,2-s2.0-84911470421
"Blankestijn M.A., Boyle R.J., Gore R., Hawrylowicz C., Jarvis D., Knulst A.C., Wardlaw A.J.",55779819100;7202685792;7102540930;7004126309;7102857763;7003983170;7102358635;,Developments in the field of allergy in 2013 through the eyes of Clinical and Experimental Allergy,2014,,https://www.scopus.com/inward/record.uri?eid=2-s2.0-84911371036&doi=10.1111%2fcea.12442&partnerID=40&md5=ff1dd84d5e2c9dcf76a5b7720f860bb1,"2013 was another exciting year for allergy in general and Clinical and Experimental Allergy in particular. In the field of asthma and rhinitis, there continued to be a focus on heterogeneity and phenotypes with increasing use of biostatistical techniques to determine clusters of similar populations. Obesity- and aspirin-associated disease are intriguing associations with asthma which were explored in a number of papers. We published a number of excellent papers on mechanisms of airway inflammation and how this relates to physiology, pathology, genetics and biomarkers in both human and experimental model systems. In terms of mechanisms, there is less on individual cell types in allergic disease at the moment, but the immunology of allergic disease continued to fascinate our authors. Another area that was popular both in the mechanisms and in the epidemiology sections was early life events and how these lead to allergic disease, with an increasing focus on the role of the microbiome and how this influences immune tolerance. In the clinical allergy section, oral immunotherapy for food allergy is clearly a major topic of interest at the moment as was in vitro testing to distinguish between sensitization and allergic disease. There was less on inhalant allergy this year, but a good representation from the drug allergy community including some interesting work on non-IgE-mediated mechanisms. In the allergen section, important new allergens continue to be discovered, but the major focus as in the last couple of years was on working out how component-resolved approaches can improve diagnosis and management of food and venom allergy. ? 2014 John Wiley & Sons Ltd.",,allergen; animal; human; hypersensitivity; immunology; Allergens; Animals; Humans; Hypersensitivity,2-s2.0-84911371036
"Clossick E., Woodward S.",56318773700;7103313677;,Alcohol brief interventions in general practice,2014,1,https://www.scopus.com/inward/record.uri?eid=2-s2.0-84910140937&doi=10.12968%2fbjhc.2014.20.10.468&partnerID=40&md5=1e5bef167c6912fc9f4f5200224bf45e,"Harmful levels of alcohol consumption are a longstanding but continually growing health concern affecting individuals, and consequently populations. Through personalised advice, alcohol brief interventions (ABIs) target drinking habits, which are deemed damaging to health. They are not targeted at dependent drinkers for whom a more intensive and specialist service would be better suited. In response to recent shifts in public-health strategy away from ABIs, and the publication of new trials into their effectiveness, this article evaluates the value of ABIs through the review of eleven relevant studies. Findings suggest that hazardous drinkers did reduce their drinking patterns following ABI, but not more so than control participants who were given standard treatment. The evolution of standard treatment to include thorough screening, non-personalised advice and sometimes literature on alcohol intake delivers an intervention, that is effective in reducing drinking. Therefore, future research and practice should focus on screening methods and quality of standard care rather than on brief interventions. ? 2014 MA Healthcare Ltd.",Alcohol brief interventions (abis); Alcohol strategy; Harmful and hazardous drinking; Practice nursing; Public health,,2-s2.0-84910140937
"Paparello J., Zeller I., While A.",55543713500;56411882100;56248868500;,Meeting the complex needs of individuals living with HIV: A case study approach,2014,1,https://www.scopus.com/inward/record.uri?eid=2-s2.0-84909946345&doi=10.12968%2fbjcn.2014.19.11.526&partnerID=40&md5=246ada95f1fcbbaf8bfce82fef0fda58,"This article critically discusses the nursing care and management of a person living with the human immunodeficiency virus (HIV) infection as a long-term condition, requiring highly complex HIV care. Complex HIV care is managed in the secondary care setting. However, recent legislation has motivated shifts in HIV care to the community care setting. This article aims to enhance health professionals' understanding in order to equip practice and district nurses to deliver HIV care provision. Antiretroviral adherence is a prerequisite for disease survival as well as an essential component of complete HIV self-care management. It is therefore imperative that nurses tailor adherence strategies according to each patient's requirements. Case management strategies such as the use of cognitive behavioural therapy to alleviate depressive symptoms will be considered. Furthermore, the use of motivational interviewing for antiretroviral adherence is highlighted as a potential intervention to help patients overcome the physical, psychological and physiological challenges of living with HIV-associated comorbidities. The delivery of integrated HIV care is pivotal for the management of the person living with HIV, as is the facilitation of a self-caring behaviour.",Disease management; HIV; HIV-associated depression; Long-term conditions; Self-management,anti human immunodeficiency virus agent; disease management; HIV Infections; human; pathophysiology; patient compliance; Anti-HIV Agents; Disease Management; HIV Infections; Humans; Patient Compliance,2-s2.0-84909946345
