作者,作者身分,"文獻名稱	",年份,施引文獻,連結,摘要,作者,索引關鍵字,EID
"Williams R.P., Oakeshott P.",7409604231;7005205251;,Authors' reply to Creagh-Brown,2014,,https://www.scopus.com/inward/record.uri?eid=2-s2.0-84901461400&doi=10.1136%2fbmj.g3322&partnerID=40&md5=b499d75bb90ee007fc037246e9c3b195,[無可用摘要],,beta adrenergic receptor blocking agent; chronic obstructive lung disease; disease severity; drug use; forced expiratory volume; human; left ventricular systolic dysfunction; letter; priority journal; spirometry; female; heart failure; Female; Heart Failure; Humans,2-s2.0-84901461400
Bewley S.,7006809728;,The Saatchi gamble that law will drive creativity in medicine,2014,1,https://www.scopus.com/inward/record.uri?eid=2-s2.0-84901008594&doi=10.1136%2fbmj.g3139&partnerID=40&md5=4d733cbf6cf3a6db47906943a81abc87,[無可用摘要],,"human; law; lawyer; letter; medical profession; physician; policy; priority journal; social status; experimental therapy; medicolegal aspect; Humans; Legislation, Medical; Therapies, Investigational",2-s2.0-84901008594
"Baljekar S., Malet A.",56770151800;56769457100;,Building a better future,2014,,https://www.scopus.com/inward/record.uri?eid=2-s2.0-84938844987&doi=10.7748%2fns2014.05.28.36.58.s56&partnerID=40&md5=b8b575f45ca752f70edfbd84a4a6526b,"The world we live in is constantly evolving and the boundaries between populations continue to change. We have become increasingly aware of the inequities in health care, and of what the response might be. This inspires some of us to take action in an attempt to bring about change.",,"child; childhood mortality; female; health care manpower; human; maternal mortality; nurse; pregnancy; Sierra Leone; United Kingdom; Child; Child Mortality; Female; Great Britain; Health Manpower; Humans; Maternal Mortality; Nurses, International; Pregnancy; Sierra Leone",2-s2.0-84938844987
"Wakefield D., Thompson L., Bruce S.",57201426360;56152020700;57206505575;,A Lilliputian army under the floorboards: Persistent delirium with complete though prolonged recovery,2014,,https://www.scopus.com/inward/record.uri?eid=2-s2.0-84899933703&doi=10.1136%2fbcr-2013-202639&partnerID=40&md5=e5b5b430d92332b2e8243ddace37350e,"We report the case of an 83-year-old man who presented with a history of fluctuating delirium of insidious onset, secondary to an amoebic liver abscess more than 30 years after acute exposure. We describe a 2-year clinical journey that started with a fall and was additionally complicated by severe weight loss and acute kidney injury (AKI). The likely prognosis for such a combination of comorbidities in an older person is for lasting morbidity, institutionalisation and significant mortality. However, the case demonstrates that with timely assessment and care complete recovery is possible though it may take many months. It reminds us of the catalytic implications of falls for older persons and to maintain a differential diagnostic approach to delirium of insidious onset avoiding misdiagnosis as dementia with which it may be associated. Our case report includes extracts from the patient's own account providing added insight into such experiences. Copyright 2014 BMJ Publishing Group. All rights reserved.",,paromomycin; abscess drainage; acute kidney failure; aged; anorexia; article; case report; computer assisted tomography; convalescence; delirium; disorientation; dysphagia; echography; falling; fatigue; hallucination; hepatomegaly; human; leukocytosis; liver amebiasis; liver dysfunction; male; memory disorder; mental test; priority journal; short term memory; very elderly; walking difficulty; weight reduction,2-s2.0-84899933703
"Jin Y., Xi C., Qin J., Preedy V.R., Yong J.",57203290590;56890636300;57212983532;7103333953;56890576900;,Vitamin D and Age-Related Macular Degeneration,2014,,https://www.scopus.com/inward/record.uri?eid=2-s2.0-84943228435&doi=10.1016%2fB978-0-12-401717-7.00034-4&partnerID=40&md5=8da8c135712aa370eee48ae16d9dff68,"Vitamin D has a role in preventing diseases of human aging, including age-related macular degeneration (AMD). Age-related macular degeneration is the principal cause of registered legal blindness among those aged over 65 in the USA, Western Europe, and Asia. The etiology and pathogenesis of AMD are still unknown. However, studies have suggested that vitamin D could delay the progress of AMD. Vitamin D<inf>3</inf> improves retinal function through reducing inflammation, reducing the number of activated macrophages, and clearance of amyloid-beta deposition. The exact process by which vitamin D protects against AMD is unknown, but putative mechanisms that arise at the molecular and cellular levels are reviewed in this chapter. Therapeutic strategies to improve vitamin D status in the individual, with the ultimate aim of ameliorating the onset of AMD, are also reviewed. ? 2014 Elsevier Inc. All rights reserved.",Age-related macular degeneration; Cholecalciferol; Cholesterol; Inflammation; Vitamin D,,2-s2.0-84943228435
"Jin Y., Xi C., Qin J., Preedy V.R., Yong J.",57199284199;56890636300;57212983533;7103333953;56890576900;,"Molecular Pathways, Green Tea Extract, (-)-Epigallocatechin Gallate, and Ocular Tissue",2014,,https://www.scopus.com/inward/record.uri?eid=2-s2.0-84943223841&doi=10.1016%2fB978-0-12-401717-7.00057-5&partnerID=40&md5=53576675f0307cf6c2d951e54c1d1fd3,"Green tea extract and (-)-epigallocatechin gallate (EGCG), extracted from the plant Carmellia sinensis, have long been known as effective antioxidants. EGCG has multifunctional properties, including anti-inflammatory, anti-ischemic, antineovascularization, antineurodegenerative, and other effects. This chapter describes the protective effects of green tea extract and EGCG on ocular tissues, including corneal epithelium cells, human lens epithelial cells, and retinal pigment epithelium cells. Green tea extract and EGCG affect a variety of molecular events, from receptor-mediated processes to signaling and altered gene expression. Green tea extract and EGCG could play important roles in the treatment of many ophthalmologic diseases, such as dry eye disease, keratitis, corneal ischemia, corneal trauma or degeneration, cataract, age-related macular degeneration, ocular hypertension, glaucoma, ocular infections, and other eye-related pathology. Most of the studies reviewed in this chapter are in?vitro or animal experiments, so further human investigations are necessary. ? 2014 Elsevier Inc. All rights reserved.",(-)-epigallocatechin gallate; Antioxidant; Green tea extract; Human lens epithelial cell; Retinal pigment epithelium cell,,2-s2.0-84943223841
"Rus-Calafell M., Guti?rrez-Maldonado J.",35094538900;9334173600;,Virtual Reality And Schizophrenia,2014,,https://www.scopus.com/inward/record.uri?eid=2-s2.0-84957990621&partnerID=40&md5=01289a1b3e04f2eead75583e686af1f2,"Virtual reality (VR) has emerged as an adjunct technique to psychological interventions for schizophrenia, especially for those using a cognitive-behavioural approach. paranoia, with non-clinical and clinical populations.developing treatment.platforms are constantly appearing to overcome some of the limitations of the usual clinical and psychological interventions for this mental disorder. Ribas-Sabat?, 2014), a new VR-integrated program that has been designed to improve the social skills and social cognition of patients suffering from schizophrenia, in one-to-one sessions. ? 2015 by Nova Science Publishers, Inc. All rights reserved.",Acceptance; Applications; Schizophrenia; Treatment; Virtual reality,,2-s2.0-84957990621
Young A.F.,36818967900;,Mapping of areas vulnerable to leptospirosis based on the analysis of floods in the S?o Paulo Metropolitan Area,2014,,https://www.scopus.com/inward/record.uri?eid=2-s2.0-84956788464&partnerID=40&md5=4127a432cd03ff9cd4e088ce94fbe525,"This chapter focuses on the relationship between climate change and the impacts of climate events, as well the importance to manage the associated risk. According to IPCC (2012), the impacts of climate extremes and the potential for disasters emerge from the interaction of physical conditions (weather/climate), from the exposure and vulnerability of human and natural systems. With global climate change, extreme weather events such as cyclones and floods are expected to occur with increasing frequency and greater intensity, which contaminates freshwater supplies, heightens the risk of water-borne diseases, and creates breeding grounds for diseases such as leptospirosis. Infectious disease outbreaks have been reported following major flood events in developing countries, and these outbreaks vary in magnitude and rates of mortality. The objective of the study was to evaluate leptospirosis at geographic locations based on environmental factors and produce a predictive disease risk map. The area of study is S?o Paulo Metropolitan Area (SPMA), one of the largest megacities in the world (with 19,956,590 people). In this case, we considered the previous analysis of Coelho and Massad (2012), where for each additional 20 mm of precipitation there was an average increase of 15.6 % in hospital admissions, as the precipitation increased from 20 mm to 120 mm. Within this context, we considered the spatial distribution of the daily number of leptospirosis cases and the probability of flood events in SPMA. We used ArcGIS to integrate the spatial information and non-spatial attribute data, where each spatial feature and its attribute information were linked. The ArcGIS also provided the ""math"" module to perform mathematical operations in order to analyze the geographical patterns and trends of the region. As a result, a map of vulnerability was produced based on the leptospirosis risk evaluation which can enable decisions to be made on strategies and interventions for improving the conditions of people living in disease-prone areas. ? 2014 by Nova Science Publishers, Inc. All rights reserved.",Climate change; Health; Leptospirosis; Precipitation,,2-s2.0-84956788464
Sandrone S.,54986841100;,Sir Francis Walshe (1885–1973),2014,,https://www.scopus.com/inward/record.uri?eid=2-s2.0-84925224543&doi=10.1007%2fs00415-013-7001-4&partnerID=40&md5=f220e3452ad82ee306761163dcd624ac,[無可用摘要],,"Article; beriberi; brain stem; consciousness; diphtheria; epidemic encephalitis; gesture; human; medical education; medical practice; motor cortex; neurologist; poliomyelitis; priority journal; professional knowledge; pyramidal nerve cell; pyramidal tract; skin sensation; spastic paraplegia; wound infection; art; education; history; neurology; United Kingdom; England; History, 20th Century; Neurology",2-s2.0-84925224543
"Docherty G., McNeill A., Gartner C.E., Szatkowski L.",36604220900;35398346200;8450161900;35238712200;,Response to Winter: 'Hardcore smoking does not necessarily indicate hardening',2014,,https://www.scopus.com/inward/record.uri?eid=2-s2.0-84896715695&doi=10.1111%2fadd.12462&partnerID=40&md5=85cced15028dde091ab9a9882f146821,[無可用摘要],,attitude; female; human; male; smoking; Tobacco Use Disorder; Attitude; Female; Humans; Male; Smoking; Tobacco Use Disorder,2-s2.0-84896715695
"Borschmann R.D., Khalifeh H., Trevillion K., Howard L.M., Moran P.",35091024300;26321679000;36093631800;7202645145;34571973600;,Screening programmes for helping mental health professionals to detect violent victimisation in people with severe mental illness,2014,,https://www.scopus.com/inward/record.uri?eid=2-s2.0-85041843910&doi=10.1002%2f14651858.CD011042&partnerID=40&md5=907bc7d75e498ad1dead37cafc625a91,"This is the protocol for a review and there is no abstract. The objectives are as follows: To review the evidence for the effectiveness of screening programmes to improve health professionals' detection of, and response to, violent victimisation in people with severe mental illness. More specifically, this review aims to examine the effectiveness of the following interventions. Screening programmes that aim to improve health professionals' detection of victimisation among people with severe mental illness, followed by referral to appropriate external specialist services. Screening programmes that aim to improve health professionals' detection of victimisation among people with severe mental illness, followed by interventions within these healthcare settings to reduce the adverse health and social outcomes of this victimisation. ? 2014 The Cochrane Collaboration.",,Article; crime victim; data synthesis; external specialist service; health program; health service; human; mental disease; mental health care personnel; mental patient; outcome assessment; partner violence; patient referral; priority journal; program effectiveness; psychotherapy; screening test; social problem; violent victimisation,2-s2.0-85041843910
"Morris T., Sumners D.P., Green D.A.",56563545000;7004003841;7404386609;,Inspiratory high frequency airway oscillation attenuates resistive loaded dyspnea and modulates respiratory function in young healthy individuals,2014,,https://www.scopus.com/inward/record.uri?eid=2-s2.0-84925283687&doi=10.1371%2fjournal.pone.0091291&partnerID=40&md5=9dcfb65df152ea8092d872614cbfee8c,"Direct chest-wall percussion can reduce breathlessness in Chronic Obstructive Pulmonary Disease and respiratory function may be improved, in health and disease, by respiratory muscle training (RMT). We tested whether high-frequency airway oscillation (HFAO), a novel form of airflow oscillation generation can modulate induced dyspnoea and respiratory strength and/or patterns following 5 weeks of HFAO training (n = 20) compared to a SHAM-RMT (conventional flow-resistive RMT) device (n = 15) in healthy volunteers (13 males; aged 20-36 yrs). HFAO causes oscillations with peak-to-peak amplitude of 1 cmH<inf>2</inf>O, whereas the SHAM-RMT device was identical but created no pressure oscillation. Respiratory function, dyspnoea and ventilation during 3 minutes of spontaneous resting ventilation, 1 minute of maximal voluntary hyperventilation and 1 minute breathing against a moderate inspiratory resistance, were compared PRE and POST 5-weeks of training (2x30 breaths at 70% peak flow, 5 days a week). Training significantly reduced NRS dyspnoea scores during resistive loaded ventilation, both in the HFAO (p = 0.003) and SHAM-RMT (p = 0.005) groups. Maximum inspiratory static pressure (cm H<inf>2</inf>O) was significantly increased by HFAO training (vs. PRE; p<0.001). Maximum inspiratory dynamic pressure was increased by training in both the HFAO (vs. PRE; p<0.001) and SHAM-RMT (vs. PRE; p = 0.021) groups. Peak inspiratory flow rate (L.s-1) achieved during the maximum inspiratory dynamic pressure manoeuvre increased significantly POST (vs. PRE; p = 0.001) in the HFAO group only. HFAO reduced inspiratory resistive loading-induced dyspnoea and augments static and dynamic maximal respiratory manoeuvre performance in excess of flow-resistive IMT (SHAM-RMT) in healthy individuals without the respiratory discomfort associated with RMT. ? 2014 Morris et al.",,adolescent; adult; amplitude modulation; article; breathing rate; controlled study; dyspnea; female; flow rate; high frequency airway oscillation; high frequency oscillation; human; lung volume; male; maximum inspiratory dynamic pressure; maximum inspiratory static pressure; muscle strength; outcome assessment; peak inspiratory flow; pressure measurement; resistive loaded ventilation; respiratory function; respiratory tract parameters; scoring system; spontaneous resting ventilation; voluntary hyperventilation; breathing exercise; breathing muscle; clinical trial; dyspnea; health; high frequency ventilation; hyperventilation; inhalation; pathophysiology; physiology; rest; young adult; Adult; Breathing Exercises; Dyspnea; Female; Health; High-Frequency Ventilation; Humans; Hyperventilation; Inhalation; Lung Volume Measurements; Male; Respiratory Muscles; Rest; Young Adult,2-s2.0-84925283687
"Schoenhagen P., Botnar R.",7004439698;35602500200;,"Plaque trek: ""to boldly go where no man has gone before""",2014,,https://www.scopus.com/inward/record.uri?eid=2-s2.0-84896094467&doi=10.1016%2fj.jacc.2013.10.077&partnerID=40&md5=bd135d59fa6326aa031df3bb101498b1,[無可用摘要],coronary artery disease; magnetic resonance imaging; prognosis,"cardiovascular risk; carotid atherosclerosis; computer assisted tomography; coronary artery atherosclerosis; coronary artery disease; human; note; nuclear magnetic resonance imaging; predictive value; priority journal; prognosis; signal noise ratio; atherosclerotic plaque; cardiac imaging; cardiovascular magnetic resonance; clinical feature; diagnostic imaging; imaging system; non invasive procedure; Note; coronary artery disease; magnetic resonance imaging; prognosis; Coronary Artery Disease; Female; Humans; Magnetic Resonance Imaging, Cine; Male; Plaque, Atherosclerotic",2-s2.0-84896094467
"Walter T.C., Knobloch G., Kasner M., Diederichs G., Hamm B., Ebersberger U., Makowski M.R.",33267983000;37037590100;8933603800;24758101200;56468905200;24922949600;35322730700;,The Great Migration: How MRI Replaces Traditional Imaging Techniques for the Characterization of Atherosclerosis,2014,,https://www.scopus.com/inward/record.uri?eid=2-s2.0-85062745350&doi=10.1007%2fs40134-013-0040-x&partnerID=40&md5=c65e7f461fc487277d9842b850459bd9,"In the Western world and developing countries, cardiovascular diseases remain the primary cause of morbidity and mortality. The incidence of cardiovascular diseases is thought to be on the rise, due to an increase in risk factors (e.g. diabetes) and aging of the population. Currently, there is no established clinical method for the in vivo characterization of atherosclerotic plaques and the prediction of ischemic stroke, myocardial infarction and other clinical complications. In this article, we will introduce novel magnetic resonance imaging (MRI) techniques and discuss how these techniques are starting to replace currently established clinical imaging methods for the detection and characterization of atherosclerotic vessel wall changes. ? 2014, Springer Science+Business Media New York.",Atherosclerosis; Cardiovascular disease; Molecular imaging; MRI,,2-s2.0-85062745350
Brose L.S.,24314804600;,"Helping pregnant smokers to quit : Behavioural support works, evidence on drug treatment still patchy",2014,1,https://www.scopus.com/inward/record.uri?eid=2-s2.0-84896990631&doi=10.1136%2fbmj.g1808&partnerID=40&md5=273e931ec71fa3f39b79c37412d271eb,[無可用摘要],,nicotine; editorial; feedback system; human; medication compliance; nicotine replacement therapy; outcome assessment; patient attitude; patient counseling; pregnancy; pregnant woman; priority journal; psychosocial care; smoking cessation; tobacco dependence; transdermal patch; Female; Humans; Pregnancy; Pregnancy Complications; Smoking; Smoking Cessation; Tobacco Use Cessation Products,2-s2.0-84896990631
Dunne S.,7005244124;,Summary of: Influence of root canal fillings on longevity of direct and indirect restorations placed within the General Dental Services in England and Wales,2014,1,https://www.scopus.com/inward/record.uri?eid=2-s2.0-84979798517&doi=10.1038%2fsj.bdj.2014.226&partnerID=40&md5=6c68a721a6d3351315b29ea66577129a,"AIM: To consider the survival of restorations in root filled and non-root filled teeth.METHODS: A data set was established consisting of patient's, 18 years or older. For each patient on the database with a tooth restored with a direct or indirect restoration with or without a root filling, the subsequent history of intervention on that tooth was consulted, and the next date of intervention, if any could be found in the data set, was obtained. Thus a data set was created of restored teeth and whether they have also received root fillings, with the dates of restoration and root filling placement and the dates, if any, of re-intervention. Modified Kaplan-Meier statistical analysis was used to quantify the distribution of time to intervention.Results Data for over 80,000 different adult patients were analysed, of whom 46% were male and 54% female. A total of 538,967 restoration placements were obtained from the data over a period of 11 years, of which 30,073 were root fillings.CONCLUSIONS: Examination of the survival of restorations in teeth with and without root canal fillings indicated that those with root canal fillings have shorter intervals before re-intervention than teeth without root fillings. Restorations on root canal treated anterior teeth with post and cores had the lowest survival time.",,"clinical practice; dental surgery; endodontics; female; human; male; procedures; statistics and numerical data; treatment outcome; Dental Restoration, Permanent; Female; Humans; Male; Outcome and Process Assessment (Health Care); Practice Patterns, Dentists'; Root Canal Obturation",2-s2.0-84979798517
"Goldsmith D., Covic A.",7102057832;7006186181;,"The EVOLVE study is negative, so what does this 'bitter pill' of disappointment mean now for renal patients?",2014,1,https://www.scopus.com/inward/record.uri?eid=2-s2.0-84896727677&doi=10.1111%2fijcp.12261&partnerID=40&md5=a8c4c20f86e26e8e2d2eb91a913dc4bd,"The extremely high morbidity and mortality experienced by subjects with chronic kidney disease (CKD) has often been described and reviewed (1), but this familiarity should not breed indifference to the huge burden of premature cardiovascular disease - something which becomes more obvious, but increasingly challenging to treat, as GFR declines, or proteinuria increases (1,2). The health outcomes for a middle-aged person entering renal replacement therapy are as bad as those seen with a major solidorgan malignancy; while there has been modest progress in improving outcomes over the last two decades, the diagnosis of significant or progressive CKD should and thus still does continue to cast a shadow over patients, carers and healthcare professionals alike. ? 2014 John Wiley & Sons Ltd.",,"alkaline phosphatase; calcimimetic agent; calcium; cholesterol; cinacalcet; fibroblast growth factor 3; hemoglobin; homocysteine; parathyroid hormone; phosphate; phosphate binding agent; placebo; vitamin D; calcimimetic agent; cinacalcet; naphthalene derivative; parathyroid hormone; alkaline phosphatase blood level; calcium blood level; cardiovascular disease; cardiovascular mortality; cholesterol blood level; chronic kidney disease; correlational study; disease course; drug cost; drug dose titration; drug withdrawal; glomerulus filtration rate; health care personnel; hemodialysis; hemoglobin blood level; human; hypercalcemia; hypocalcemia; intention to treat analysis; morbidity; mortality; multicenter study (topic); nausea; outcome assessment; overall survival; parathyroid hormone blood level; parathyroidectomy; phosphate blood level; priority journal; proteinuria; randomized controlled trial (topic); renal replacement therapy; review; treatment outcome; vomiting; adolescent; adult; aged; Cardiovascular Diseases; complication; hyperparathyroidism; metabolism; middle aged; prospective study; Renal Insufficiency, Chronic; very elderly; young adult; Adolescent; Adult; Aged; Aged, 80 and over; Calcimimetic Agents; Cardiovascular Diseases; Humans; Hyperparathyroidism; Middle Aged; Multicenter Studies as Topic; Naphthalenes; Parathyroid Hormone; Prospective Studies; Randomized Controlled Trials as Topic; Renal Insufficiency, Chronic; Renal Replacement Therapy; Treatment Outcome; Young Adult",2-s2.0-84896727677
Bick D.,55859601200;,Female genital mutilation: The abuse has to stop,2014,,https://www.scopus.com/inward/record.uri?eid=2-s2.0-84894647404&doi=10.1016%2fj.midw.2014.02.001&partnerID=40&md5=cf48f29368a673c1d521ab4dc60896e3,[無可用摘要],,"adverse effects; child abuse; cultural anthropology; female; female genital mutilation; female genital system; human; infant; legislation and jurisprudence; surgery; United Kingdom; Child Abuse; Circumcision, Female; Cultural Diversity; Female; Genitalia, Female; Great Britain; Humans; Infant",2-s2.0-84894647404
"Wilmot M.-C., Perrett C.M., Calonje E., Weir J., Bunker C.B.",55974503600;7003451489;7005215064;7102577953;7102435767;,A crusted lesion on the penis,2014,,https://www.scopus.com/inward/record.uri?eid=2-s2.0-84894089631&doi=10.1111%2fced.12230&partnerID=40&md5=14ec880250cfb328658d142886e06fc9,[無可用摘要],,"Acantholysis; Diagnosis, Differential; Humans; Male; Middle Aged; Penile Diseases; Skin Diseases; acantholysis; acantholytic dermatosis; adult; case report; dermis; histopathology; human; human tissue; immunofluorescence; inflammatory infiltrate; male; middle aged; penis; priority journal; scar formation; Short Survey",2-s2.0-84894089631
"Aguilar-Duran S., Martin B., Archer C.B., Attard N.R.",54891953800;57213404936;55184628200;55587796700;,A rapidly enlarging nodule on the scalp,2014,1,https://www.scopus.com/inward/record.uri?eid=2-s2.0-84894064346&doi=10.1111%2fced.12217&partnerID=40&md5=c0ee9190da8ebef6da233b6ff0b744c4,[無可用摘要],,"Aged; Carcinoma, Neuroendocrine; Diagnosis, Differential; Head and Neck Neoplasms; Humans; Male; Scalp Dermatoses; Skin Neoplasms; antiandrogen; chromogranin A; docetaxel; fluorodeoxyglucose; mitoxantrone; synaptophysin; aged; apoptosis; Article; bone metastasis; cancer chemotherapy; cancer size; case report; computer assisted emission tomography; diaphragm; Gleason score; histopathology; human; human tissue; immunohistochemistry; lymphadenopathy; male; metastasis; mitosis; neuroendocrine tumor; neurofilament; primary neuroendocrine carcinoma; priority journal; prostate adenocarcinoma; scalp; skin examination; skin nodule; skin ulcer",2-s2.0-84894064346
