作者,作者身分,"文獻名稱	",年份,施引文獻,連結,摘要,作者,索引關鍵字,EID
Samsi K.,24779032000;,Negotiating Capacity and Consent in Substance Misuse,2014,1,https://www.scopus.com/inward/record.uri?eid=2-s2.0-84927799695&doi=10.1002%2f9781118430965.ch1&partnerID=40&md5=d50ded44e7c37129e4fa6b8d36cc3c38,"An individual's ability to make decisions for themselves is enshrined and safeguarded by the Mental Capacity Act 2005 in England and Wales, and similar legislation in other countries. The Act's presumption of capacity and its safeguarding the interests of 'unwise decisions' being made are perhaps its most relevant features for older people with problems of substance misuse. The Act also advocates setting out advance statements and decision making in advance, further protecting individuals who may be unable to make decisions for themselves in the future. Best interest decision making is another guiding principle of assessing whether or not an individual who is deemed as lacking capacity to make their own decisions is at risk of their needs remaining unmet. ? 2015 John Wiley & Sons, Ltd..",Capacity; Consent; Decision making capacity; Mental capacity; Mental Capacity Act 2005; Myopia; Substance abuse,,2-s2.0-84927799695
Rao R.T.,55146642900;,Integrated Treatment Models for Co-Morbid Disorders,2014,,https://www.scopus.com/inward/record.uri?eid=2-s2.0-84927792312&doi=10.1002%2f9781118430965.ch23&partnerID=40&md5=e6b30875b215d1d38cb74b97d4769f59,"Traditional service models for older people with substance misuse and co-morbid mental disorders (SMCD) have often involved systems that provide fragmented care. Such care is associated with treatment by more than one service at any one time or by one service after another. This has meant the lack of an overview and ineffective management of more than one group of disorders. Integrated services are relatively new to service delivery for older people, but considerable progress has been made in the past decade to address this unmet need. This chapter outlines service implications, current systems of service delivery and the development of integrated SMCD services for older people, drawing upon existing research and drawing out future direction in this expanding field of mental health. ? 2015 John Wiley & Sons, Ltd.",Elderly; Older People; Service integration; Substance Abuse,,2-s2.0-84927792312
"Millard C., Wessely S.",55370715800;7102849907;,Authors' reply to Timimi,2014,,https://www.scopus.com/inward/record.uri?eid=2-s2.0-84919933969&doi=10.1136%2fbmj.g7619&partnerID=40&md5=8dba2a13e8e78eaab553ee4fc852ced9,[無可用摘要],,"neuroleptic agent; drug safety; Letter; mental disease; obesity; ontology; attitude to health; economics; health care delivery; health insurance; human; legislation and jurisprudence; mental health service; Attitude to Health; Health Benefit Plans, Employee; Health Services Accessibility; Humans; Insurance, Health; Mental Health Services",2-s2.0-84919933969
"Bornstein S.R., Amiel S.A., Rubino F., Mingrone G., Kamvissi V., Solimena M., Bonifacio E., Jones P., Schwarz P., Birkenfeld A.L., Behrens A., Barthel A., Lechler R., Peakman M.",7102751718;7005763485;56677466000;7006575737;35074251700;7006817892;7005707386;36077498900;35389845200;8964314200;35480950900;56208430400;7103135937;7005867806;,Erratum: Creating a Transcampus in Diabetes Research between King's College London and the Technische Universit?t Dresden: Update on Islet Biology and Transplantation (Hormone and Metabolic Research (2015) 47),2014,,https://www.scopus.com/inward/record.uri?eid=2-s2.0-84941791227&doi=10.1055%2fs-0034-1396842&partnerID=40&md5=54234056440f20f44608bb29a427c348,[無可用摘要],,Erratum; error,2-s2.0-84941791227
"Lambe S., Mogg A., Eranti S., Pluck G., Hastilow S., McLoughlin D.M.",56062305400;15728234300;6507399293;6506948010;6504522820;7005061686;,Trends in use of electroconvulsive therapy in south london from 1949 to 2006,2014,1,https://www.scopus.com/inward/record.uri?eid=2-s2.0-84928292585&doi=10.1097%2fYCT.0000000000000112&partnerID=40&md5=0188ba09bbb46bb4580d33ac47e7592d,"Objectives: Electroconvulsive therapy (ECT) remains the most acutely effective treatment for severe depression, but its use has declined since its introduction more than 70 years ago. To provide some historical perspective on changes in ECT practice, the objective of the present study was to identify trends in ECT practice in selected teaching hospitals in South London, UK, between 1949 and 2006.Methods: Annual rates of ECT for 1949-1970 were estimated from the contemporary hospital reports of the Maudsley and Bethlem Royal hospitals in South London, UK. Case notes were also retrospectively reviewed to calculate annual rates of ECT administration and extract demographic and clinical information for approximately every 5 years between 1987 and 2006.Results: The annual rate of ECT peaked at 35% of total admission in 1956 and declined gradually thereafter to 10.8% by 1970 and fell below 2.2% from 1991 onward. Depressed and female patients were more likely to receive ECT. Compared to previous years, patients were more severely ill and treatment resistant in 2006, whereas ethnic minorities made up 30% of patients receiving ECT compared to approximately 14% in the preceding years.Conclusions: Currently, ECT seems to be provided increasingly late in more severe illness episodes. The ethnicity of patients receiving ECT in South London may be becoming more representative of the background population, but ECT is being used relatively more frequently for nonaffective disorders in ethnic minorities. Copyright ? 2014 by Lippincott Williams & Wilkins.",Depression; ECT; Ethnicity; Historical; Trends,"adult; aged; amnesia; anesthesia complication; Article; confusion; death; depression; disease severity; DSM-IV; electroconvulsive therapy; female; human; major clinical study; male; retrospective study; teaching hospital; United Kingdom; Depressive Disorder, Major; electroconvulsive therapy; ethnic group; history; middle aged; socioeconomics; treatment outcome; trends; Adult; Aged; Depressive Disorder, Major; Electroconvulsive Therapy; Ethnic Groups; Female; History, 20th Century; History, 21st Century; Humans; London; Male; Middle Aged; Retrospective Studies; Socioeconomic Factors; Treatment Outcome",2-s2.0-84928292585
"Potter T., Chan W.L., Archer J.R.H., Barrett J., Dargan P.I., Wood D.M.",57196724248;55682562500;56233324600;57196745706;7004249431;55322365400;,Development of a ‘patient information leaflet’ for use following assessment of patients with reported or suspected paracetamol overdose in the UK,2014,,https://www.scopus.com/inward/record.uri?eid=2-s2.0-85033699522&doi=10.1002%2fprp2.75&partnerID=40&md5=f203730f309054512f2354c142ee9232,"The aim of this study was to design an information leaflet for patients with paracetamol overdose based on Medicines and Healthcare products Regulatory Agency guidance and to assess its readability. A two-sided one page information leaflet was designed for patients being discharged from hospital after a paracetamol overdose. Patients presenting with an acute paracetamol overdose, irrespective of whether they were treated or not, were recruited to read the leaflet and then answer a brief structured questionnaire based on the leaflet. The readability of the information leaflet was assessed using the Flesch reading ease score. Thirty patients (15 male, 12 female, 3 not recorded; mean age 38?±?13.0?years) were recruited, wherein 100% of patients reported the language used was understandable, 96.6% knew which symptoms would require urgent medical review after discharge and 100% of patients knew the liver was affected by paracetamol. The Flesch reading ease score was 67.6 (out of a maximum of 100), equivalent to a UK reading age of 10–11years old. Our information leaflet for all patients being discharged after paracetamol overdose was well received by patients, provided them with the required knowledge and had an appropriate reading age based on UK literacy rates. We would recommend that this leaflet could be used as a template on a national level, localized to individual hospitals, to improve patient knowledge of paracetamol toxicity, and facilitate early medical review in the event of deterioration following discharge from the hospital. ? 2014 The Authors. Pharmacology Research & Perspectives published by John Wiley & Sons Ltd, British Pharmacological Society and American Society for Pharmacology and Experimental Therapeutics.",outcome; overdose; Paracetamol; patient safety,acetylcysteine; paracetamol; adult; Article; clinical article; clinical outcome; drug overdose; female; hospital discharge; human; intoxication; male; patient assessment; patient information; patient safety; priority journal; reading; structured questionnaire; United Kingdom,2-s2.0-85033699522
Bewley S.,57202703231;,Letter to the editor: Legal scrutiny of the age extension breast screening trial is required,2014,,https://www.scopus.com/inward/record.uri?eid=2-s2.0-84989171964&doi=10.1177%2f0025817214558170&partnerID=40&md5=d1330fb2ccd46e478d53740a6b05fbb8,[無可用摘要],,age; Breast Neoplasms; female; human; mass screening; mortality; Age Factors; Breast Neoplasms; Female; Humans; Mass Screening,2-s2.0-84989171964
McGurk M.,55334602300;,Summary of: managing patients on bisphosphonates: the practice of primary care dentists before and after the publication of national guidance,2014,,https://www.scopus.com/inward/record.uri?eid=2-s2.0-84964314484&doi=10.1038%2fsj.bdj.2014.1122&partnerID=40&md5=200e50041354e324ebca79f825cb1b37,"BACKGROUND: In April 2011 the Scottish Dental Clinical Effectiveness Programme published the Oral health management of patients prescribed bisphosphonates guidance document. The aims of this study were to examine whether dentists' practice and beliefs changed after guidance publication to determine whether a knowledge translation intervention was required, and to inform its development.METHODS: Three postal surveys sent to three independent, random samples of dentists throughout Scotland pre- and post-guidance publication. The questionnaire, framed using the theoretical domains framework (TDF), assessed current practice and beliefs relating to recommended management of patients on bisphosphonates.RESULTS: The results (N = 420) suggest that any significant impact the guidance may have had on the recommended management of patients on bisphosphonates by primary care dentists, had reached its peak ten months post publication. A more positive attitude, greater perceived ability, and greater motivation were all associated with significantly more performing of all recommended behaviours at every time point.CONCLUSIONS: Prior to this study, there was little available information about how patients on bisphosphonates were being managed in primary dental care, or what beliefs may be influencing management decisions. This study was able to identify levels of compliance pre- and post-guidance publication and determine that further intervention was necessary to enable sustained uptake of recommendations. Using the TDF to identify beliefs associated with best practice made it possible to suggest theoretically informed strategies for service improvement. The next step is to test the intervention(s) in a randomised controlled trial.",,"bisphosphonic acid derivative; bone density conservation agent; clinical practice; female; human; male; practice guideline; statistics and numerical data; Bone Density Conservation Agents; Diphosphonates; Female; Guideline Adherence; Humans; Male; Practice Patterns, Dentists'",2-s2.0-84964314484
"Diachun L., Charise A., Goldszmidt M., Hui Y., Lingard L.",12763215000;34881414700;23568261100;57194868649;57203176526;,Exploring the realities of curriculum-by-random-opportunity: The case of geriatrics on the internal medicine clerkship rotation,2014,1,https://www.scopus.com/inward/record.uri?eid=2-s2.0-84936879167&doi=10.5770%2fcgj.17.133&partnerID=40&md5=6e8d523feff89c1e2932cef400063a91,"Background While major clerkship blocks may have objectives related to specialized areas such as geriatrics, gay and lesbian bisexual transgender health, and palliative care, there is concern that teaching activities may not attend sufficiently to these objectives. Rather, these objectives are assumed to be met ""by random opportunity"".(1) This study explored the case of geriatric learning opportunities on internal medicine clinical teaching units, to better understand the affordances and limitations of curriculum by random opportunity. Methods Using audio-recordings of morning case review discussions of 13 patients > 65 years old and the Canadian geriatric core competencies for medical students, we conducted a content analysis of each case for potential geriatric and non-geriatric learning opportunities. These learning opportunities were compared with attendings' case review teaching discussions. The 13 cases contained 40 geriatric-related and 110 non-geriatric-related issues. While many of the geriatric issues (e.g., delirium, falls) were directly relevant to the presenting illness, attendings' teaching discussions focused almost exclusively on non-geriatric medical issues, such as management of diabetes and anemia, many of which were less directly relevant to the reason for presenting to hospital. Results The authors found that the general medicine rotation provides opportunities to acquire geriatric competencies. However, the rare uptake of opportunities in this study suggests that, in curriculum-by-random-opportunity, presence of an opportunity does not justify the assumption that learning objectives will be met. Conclusions More studies are required to investigate whether these findings are transferrable to other vulnerable populations about which undergraduate students are expected to learn through curriculum by random opportunity. ? 2014 Author(s).",Clinical Clerkship; Core competencies; Curriculum-By-Random-Opportunity; Geriatrics,,2-s2.0-84936879167
"Mieli-Vergani G., Vergani D.",56606362300;7102811464;,Autoimmune hepatitis and sclerosing cholangitis,2014,,https://www.scopus.com/inward/record.uri?eid=2-s2.0-84929663716&doi=10.1007%2f978-1-4614-9005-0_16&partnerID=40&md5=47f1bebea6780a08ad3da9bbb42d8ffc,"Autoimmune hepatitis (AIH) and sclerosing cholangitis are major causes of liver disease in children and adolescents and should always be considered in the differential diagnosis of childhood hepatopathies. Both conditions have clinical and laboratory features, response to treatment and outcome different from their adult counterparts. A common form of sclerosing cholangitis in childhood has strong autoimmune features and is referred to as autoimmune sclerosing cholangitis (ASC). The presentation of AIH and sclerosing cholangitis is nonspecific and can mimic most other liver disorders. As prompt treatment, particularly in AIH, is life saving, it is imperative to suspect these conditions and perform appropriate investigations in all children who present with a cryptogenic liver disorder. ? 2014 Springer Science+Business Media New York. All rights reserved.",,,2-s2.0-84929663716
"Creese B., Corbett A., Jones E., Fox C., Ballard C.",37086873400;35572940700;57199177828;57202632412;35351371500;,Role of the Extended MAPT Haplotype in the Worsening of Psychotic Symptoms and Treatment Response in Alzheimer Disease,2014,1,https://www.scopus.com/inward/record.uri?eid=2-s2.0-84912530066&doi=10.1016%2fj.jamda.2014.08.011&partnerID=40&md5=c1f34c229c736cba831d3803c2869901,"Introduction: There is evidence that neurofibrillary tangle (NFT) burden is associated with psychotic symptoms in Alzheimer disease (AD). However, it is not clear whether this association is direct or mediated through the increased cognitive impairment associated with NFTs. Methods: We sought to determine whether the extended MAPT haplotype was associated with the worsening of delusions and hallucinations in a combined cohort of 95 patients who participated in 2 clinical trials of treatment with memantine. Results: After controlling for baseline dementia severity, exposure to memantine, and antipsychotics, analysis shows that carriers of at least one H2 allele had a 5.4-fold (. P=.03) increased risk of worsening hallucinations. There was some evidence of association with worsening delusions but only in analysis by allele. Conclusion: These results are the first to indicate that the H2 allele of the extended MAPT haplotype negatively affects the course of psychotic symptoms in AD independently of disease severity. It will be important for future research to examine MAPT transcription in people with AD with and without psychotic symptoms to understand the exact mechanisms underlying these findings. ? 2014 AMDA - The Society for Post-Acute and Long-Term Care Medicine.",Alzheimer disease; Delusions; Hallucinations; MAPT; Psychosis; Tau,"MAPT protein; memantine; neuroleptic agent; protein derivative; quetiapine; risperidone; unclassified drug; amino acid receptor blocking agent; MAPT protein, human; memantine; tau protein; adult; aged; allele; Alzheimer disease; Article; cognitive defect; cohort analysis; controlled study; delusion; dementia; disease association; disease severity; female; genetic association; hallucination; human; major clinical study; male; middle aged; neurofibrillary tangle; psychosis; randomized controlled trial; treatment response; Alzheimer disease; disease course; genetics; haplotype; Psychotic Disorders; treatment outcome; Aged; Alleles; Alzheimer Disease; Antipsychotic Agents; Delusions; Disease Progression; Excitatory Amino Acid Antagonists; Female; Hallucinations; Haplotypes; Humans; Male; Memantine; Psychotic Disorders; tau Proteins; Treatment Outcome",2-s2.0-84912530066
Sandall J.,8544428300;,The 30th International Confederation of Midwives Triennial Congress: Improving Women's Health Globally,2014,,https://www.scopus.com/inward/record.uri?eid=2-s2.0-84911470238&doi=10.1111%2fbirt.12142&partnerID=40&md5=b05e1f4d26525b90933814dc835ed0e3,[無可用摘要],,female; health; human; midwife; women's health; Female; Global Health; Humans; Midwifery; Women's Health,2-s2.0-84911470238
"Weeks K.L., Avkiran M.",36116084500;7005663200;,Exchanging cardiac phenotype: Is AKT-mediated NHE1 inhibition a permissive switch in physiological hypertrophy?,2014,,https://www.scopus.com/inward/record.uri?eid=2-s2.0-84911367188&doi=10.1016%2fj.yjmcc.2014.10.007&partnerID=40&md5=a21c44c629b05c368b236b4a6e2c948e,[無可用摘要],,"calcineurin; calcium calmodulin dependent protein kinase II; glycogen synthase kinase 3beta; phosphatidylinositol 3 kinase; protein kinase B; serine; sodium proton exchange protein 1; somatomedin C; cation transport protein; protein kinase B; SLC9A1 protein, human; sodium proton exchange protein; Akt1 gene; Editorial; enzyme activity; gain of function mutation; gene; heart disease; heart hypertrophy; heart muscle cell; nonhuman; pathogenesis; phenotype; protein expression; protein function; protein phosphorylation; signal transduction; swimming; animal; enzymology; heart; human; hypertrophy; metabolism; phenotype; physiology; Animals; Cation Transport Proteins; Heart; Humans; Hypertrophy; Phenotype; Proto-Oncogene Proteins c-akt; Sodium-Hydrogen Antiporter",2-s2.0-84911367188
Dasgupta P.,7201405986;,Surgical Science - Everything is not what it seems,2014,,https://www.scopus.com/inward/record.uri?eid=2-s2.0-84911138724&doi=10.1111%2fbju.12973&partnerID=40&md5=36587565d621a8aea91b57226392fbac,[無可用摘要],,"histone deacetylase 2; bone scintiscanning; clinical effectiveness; clinical practice; cystectomy; Editorial; human; intermethod comparison; kidney surgery; laparoscopy; metastasis; nephron sparing surgery; open radical cystectomy; Peyronie disease; positron emission tomography; postoperative complication; professional knowledge; prostate cancer; quality of life; randomized controlled trial (topic); robotics; surgical training; computer assisted surgery; medical research; robotic surgical procedure; Biomedical Research; Humans; Positron-Emission Tomography; Robotic Surgical Procedures; Surgery, Computer-Assisted",2-s2.0-84911138724
"Cook G., Goh V.",8880415200;7004035095;,Bone metastases in prostate cancer: Which scan?,2014,,https://www.scopus.com/inward/record.uri?eid=2-s2.0-84911067134&doi=10.1111%2fbju.12716&partnerID=40&md5=876d0d95da696cf63ab0e152e6dcc5d7,[無可用摘要],,"bisphosphonic acid derivative; choline f 18; choline kinase; fluorine 18; medronate technetium tc 99m; radioisotope; unclassified drug; bone metastasis; bone scintiscanning; cell membrane; cell metabolism; computer assisted emission tomography; diagnostic accuracy; diffusion weighted imaging; Editorial; enzyme activity; human; image analysis; nuclear magnetic resonance imaging; osteoblast; prostate cancer; sensitivity and specificity; single photon emission computer tomography; tumor cell; whole body scintiscanning; computer assisted tomography; male; pathology; positron emission tomography; procedures; prostate tumor; radiography; scintiscanning; secondary; spinal cord tumor; Humans; Male; Positron-Emission Tomography; Prostatic Neoplasms; Spinal Neoplasms; Tomography, X-Ray Computed",2-s2.0-84911067134
"Wood S.D., Coster S., Norman I.",56091891800;6602394422;7005406613;,"Comparing the monitoring of patients transferred from a critical care unit to hospital wards at after-hours with day transfers: An exploratory, prospective cohort study",2014,1,https://www.scopus.com/inward/record.uri?eid=2-s2.0-84909641969&doi=10.1111%2fjan.12410&partnerID=40&md5=beb204d7d236dd86dad0e1c6be68e1f9,"Aims: To investigate possible factors related to patient monitoring to explain the higher mortality rates associated with after-hours transfers compared with daytime transfers from critical care units to the wards. Background: International research suggests that patients transferred from critical care units after-hours have a higher mortality rate than transfers during daytime, although the reasons remain unknown. Design: A prospective exploratory study. Methods: Twenty-nine patients transferred from a UK critical care unit to a ward within the same hospital after-hours for 10 weeks beginning April 2009 were compared with 29 transfers during daytime hours matched on potentially confounding characteristics. UK Critical Care Unit transfer guidelines have remained unchanged since data collection. Outcomes were as follows: (i) frequency of nursing observations; (ii) time periods from transfer to first medical review; (iii) time period from transfer to first clinical observations; (iv) frequency of transfer to an inappropriate ward; (v) delayed transfers from Critical Care Unit to ward. Results: Using Wilcoxon's Rank test (two tail) to compare paired data from the matched groups, observations were recorded significantly less frequently within the first 12 hours for after-hours transfers. Time from transfer to first clinical observations was significantly longer for after-hour transfer patients. The delay from when the patient was ready for ward care and actual transfer was also longer for the after-hours transfer group. Conclusions: Surveillance differences, including time to the first set of observations and frequency of observations in the first 12 hours, are potential factors that may explain the differential mortality associated with after-hours transfers. ? 2014 John Wiley & Sons Ltd.",After-hours transfers; Critical care; Mortality; Nursing; Observation,"adolescent; adult; aged; cohort analysis; comparative study; female; health care delivery; human; intensive care; intensive care unit; male; middle aged; mortality; patient transport; physiologic monitoring; prospective study; statistics and numerical data; time; United Kingdom; very elderly; Adolescent; Adult; After-Hours Care; Aged; Aged, 80 and over; Cohort Studies; Critical Care; Female; Great Britain; Hospital Mortality; Humans; Intensive Care Units; Male; Middle Aged; Monitoring, Physiologic; Patient Transfer; Prospective Studies; Time Factors",2-s2.0-84909641969
"Bekele E., Bodmer W.F., Bradman N., Craig I.W., Makani J., Povey S., Rotimi C.",6701642486;56181057300;6602156619;7102548208;57200801395;7102845053;7006238725;,Molecular genetics research in sub-Saharan Africa: how can the international community help?,2014,1,https://www.scopus.com/inward/record.uri?eid=2-s2.0-84907963821&doi=10.1186%2fs11568-014-0002-2&partnerID=40&md5=1bbf3a5677690258083659b76000d222,"Background: Opportunities provided by rapidly increasing access to educational resources, clinical and epidemiological data, DNA collections, cheaper technology and financial investment, suggest that researchers in sub-Saharan Africa outside South Africa (SSAOSA) could now join the genomics revolution on equal terms with those in the West.Findings: Current evidence, however, suggests that, in some cases, various factors may be compromising this development. One interpretation is that urgent practical problems, which may compromise motivation, aspiration and ambition, are blocking opportunity.Conclusions: Those wishing to help should support the SSAOSA scientists both at the level of extending collaboration networks and in stimulating academic leadership at national and institutional levels to ensure adequate resources are allocated. Members of organisations representing the international community of human geneticists, such as HUGO, have a significant responsibility in supporting such activities. ? 2014, Bekele et al.; licensee Springer.",,Africa south of the Sahara; Article; community medicine; human; international cooperation; medical research; molecular genetics; publication,2-s2.0-84907963821
