"文獻名稱.","年份","摘要","索引關鍵字"
"Different routes of heroin intake cause various heroin-induced leukoencephalopathies",2019,"Objective: Toxic leukoencephalopathy is a rare but critical neurological disorder in heroin abusers. Our aim is to compare the clinical manifestations, brain MRIs and prognoses of heroin-induced leukoencephalopathy by different intake routes. Methods: We present two patients with toxic leukoencephalopathy caused by intravenous (IV) injection of heroin and 48 additional cases from systematic reviews of the literature published between 1994 and 2018. Results: Among the 50 heroin abusers who developed leukoencephalopathy, inhalation was the most popular route (60%), followed by IV injection (30%) and snorting (10%). Mental changes, mutism and urine/fecal incontinence were the major symptoms in patients who IV injected heroin, while cerebellar ataxia and dysarthria were more common among those who inhaled heroin. Delayed-onset encephalopathy uniquely occurred in those who IV injected heroin, whereas progressive encephalopathy was more commonly observed in those who inhaled heroin. Clinical improvement was observed in 60% of patients, the overall mortality rate was 12%, and higher mortality was observed in patients who used the inhalation route (16.7%). The hallmarks on the MRIs of those who inhaled heroin were posterior to anterior involvement of the cerebral white matter and lesions in the posterior limbs of the internal capsules, cerebellum and brainstem. In contrast, those who IV injected heroin had more frequent lesions in the subcortical U fibers and the genu of the internal capsules. Conclusion: These data could help physicians make an early diagnosis and predict prognosis and suggest that prompt antioxidative or symptomatic treatments might reduce the long-term consequences and mortality of heroin-induced leukoencephalopathy. ? 2018, Springer-Verlag GmbH Germany, part of Springer Nature.","alpha tocopherol; ascorbic acid; choline; diamorphine; n acetylaspartic acid; ubidecarenone; diamorphine; narcotic agent; acute kidney failure; adult; akinetic mutism; Article; bradykinesia; brain disease; brain stem; capsula interna; case report; cerebellar ataxia; cerebellum; clinical article; clinical feature; compulsion; confusion; corpus callosum; delta rhythm; dysarthria; electroencephalogram; emergency ward; feces incontinence; Glasgow coma scale; hepatitis; heroin dependence; human; hyperthermia; inhalation; intoxication; intravenous drug abuse; irritability; leukoencephalopathy; limb weakness; male; mental disease; mortality rate; mutism; neurologic examination; nuclear magnetic resonance imaging; nuclear magnetic resonance spectroscopy; paraplegia; priority journal; prognosis; rhabdomyolysis; systematic review; tachycardia; urge incontinence; urinalysis; urine retention; white matter lesion; chemically induced; complication; diagnostic imaging; heroin dependence; inhalational drug administration; intranasal drug administration; intravenous drug administration; leukoencephalopathy; nuclear magnetic resonance imaging; pathology; pathophysiology; Administration, Inhalation; Administration, Intranasal; Administration, Intravenous; Adult; Heroin; Heroin Dependence; Humans; Leukoencephalopathies; Magnetic Resonance Imaging; Male; Narcotics"
"Chikungunya virus inhibition by synthetic coumarin–guanosine conjugates",2019,"Since its discovery in Tanganyika, Africa in 1952, chikungunya virus (CHIKV) outbreaks have occurred in Africa, Asia, Europe, and America. Till now chikungunya fever has spread in nearly 40 countries. Because of lack of effective vaccines and antiviral drugs to intervene this disease, 21 new conjugated compounds were designed and synthesized by coupling of 6,8-dithioguanosine at its C-6 position with 3-(chloromethyl)coumarins bearing an F, Cl, Br, Me, or –OMe substituent through the –SCH2– joint. Meanwhile, an organic “dummy” ligand (e.g., methyl, benzyl, and naphthylmethyl) or a coumarinyl moiety was attached at the C-8 position. By high through-put screening, three of these new conjugates were found to inhibit CHIKV in Vero cells with significant potency (EC50 = 9.9–13.9 μM) and showed low toxicity (CC50 = 96.5–212 μM). The selectivity index values were 9.37–21.7. Their structure–activity relationship was deduced, which indicates that the coumarin moiety is essential and the presence of a –OMe group enhances the antiviral activity. ? 2019 Elsevier Masson SAS","2 amino 6 (6' methoxycoumarin 3' yl)methylthio 8 (1'' naphthylmethylthio) 9 (beta d ribofuranos 1''' yl)purine; 2 amino 6,8 bis[(6' methoxycoumarin 3' yl)methylthio] 9 (beta d ribofuranos 1'' yl); 2 amino 6,8 bis[(8' methoxycoumarin 3' yl)methylthio] 9 (beta d ribofuranos 1'' yl); 3 [(methylthio) methyl]coumarin; antivirus agent; coumarin; coumarin derivative; guanosine; unclassified drug; antivirus agent; coumarin; coumarin derivative; guanosine; alkylation; antiviral activity; Article; carbon nuclear magnetic resonance; chikungunya; Chikungunya virus; controlled study; drug conjugation; drug synthesis; fast atom bombardment mass spectrometry; high throughput screening; lipophilicity; Michael addition; nucleophilicity; proton nuclear magnetic resonance; selectivity index; structure activity relation; Vero cell line; animal; chemical phenomena; chemistry; Chikungunya virus; Chlorocebus aethiops; drug effect; IC50; Animals; Antiviral Agents; Cercopithecus aethiops; Chikungunya virus; Coumarins; Guanosine; Hydrophobic and Hydrophilic Interactions; Inhibitory Concentration 50; Vero Cells"
"A novel miR-365-3p/EHF/keratin 16 axis promotes oral squamous cell carcinoma metastasis, cancer stemness and drug resistance via enhancing β5-integrin/c-met signaling pathway",2019,"Background: Targeting the c-Met signaling pathway has become a therapeutic strategy in multiple types of cancer. We unveiled a novel c-Met regulating mechanism that could be applied as a modality for oral squamous cell carcinoma (OSCC) therapy. Methods: Upregulation of keratin 16 (KRT16) was found by comparing isogenic pairs of low and high invasive human OSCC lines via microarray analysis. OSCC cells with ectopic expression or silencing of KRT16 were used to scrutinize functional roles and associated molecular mechanisms. Results: We observed that high KRT16 expression significantly correlated with poorer pathological differentiation, advanced stages, increased lymph nodes metastasis, and decreased survival rate from several Taiwanese OSCC patient cohorts. We further revealed that miR-365-3p could target ETS homologous factor (EHF), a KRT16 transcription factor, to decrease migration, invasion, metastasis and chemoresistance in OSCC cells via inhibition of KRT16. Under confocal microscopic examination, c-Met was found possibly partially associates with KRT16 through β5-integrin. Colocalization of these three proteins may facilitate c-Met and β5-integrin-mediated signaling in OSCC cells. Depletion of KRT16 led to increased protein degradation of β5-integrin and c-Met through a lysosomal pathway leading to inhibition of their downstream Src/STAT3/FAK/ERK signaling in OSCC cells. Knockdown of KRT16 enhanced chemosensitivity of OSCC towards 5-fluorouracil (5-FU). Various combination of c-Met inhibitor (foretinib), protein tyrosine kinase inhibitor (genistein), β5-integrin antibody, and 5-FU markedly augmented cytotoxic effects in OSCC cells as well as tumor killing effects in vitro and in vivo. Conclusions: Our data indicate that targeting a novel miR-365-3p/EHF/KRT16/β5-integrin/c-Met signaling pathway could improve treatment efficacy in OSCC. ? 2019 The Author(s).","beta5 integrin; cytokeratin 16; ETS homologous factor; fluorouracil; foretinib; genistein; microRNA; microRNA 365 3p; scatter factor receptor; transcription factor; unclassified drug; beta integrin; beta5 integrin; cytokeratin 16; EHF protein, human; fluorouracil; KRT16 protein, human; microRNA; MIRN365 microRNA, human; scatter factor receptor; transcription factor; adult; aged; animal experiment; animal model; animal tissue; Article; beta5 integrin c met signaling pathway; cancer staging; cancer stemness; carcinogenesis; carcinogenicity; cell differentiation; cell migration; chemosensitivity; cohort analysis; confocal microscopy; controlled study; drug cytotoxicity; drug efficacy; ectopic expression; female; gene function; gene silencing; genetic association; human; human cell; in vitro study; in vivo study; infant; KRT16 gene; lymph node metastasis; lysosome; major clinical study; male; metastasis; microarray analysis; molecular biology; mouse; mouth squamous cell carcinoma; nonhuman; oral squamous cell carcinoma cell line; priority journal; protein degradation; protein depletion; protein localization; protein protein interaction; signal transduction; survival rate; Taiwanese; transcription initiation; tumor invasion; upregulation; animal; cell motion; drug effect; drug resistance; gene expression regulation; genetics; lymph node metastasis; mouth tumor; pathology; SCID mouse; signal transduction; squamous cell carcinoma; tumor cell line; Animals; Carcinoma, Squamous Cell; Cell Line, Tumor; Cell Movement; Drug Resistance, Neoplasm; Fluorouracil; Gene Expression Regulation, Neoplastic; Humans; Integrin beta Chains; Keratin-16; Lymphatic Metastasis; Mice; Mice, SCID; MicroRNAs; Mouth Neoplasms; Proto-Oncogene Proteins c-met; Signal Transduction; Transcription Factors"
"Effects of transcranial direct current stimulation over right posterior parietal cortex on attention function in healthy young adults",2019,"Attention involves three distinct networks for alerting, orienting, and executive control. Interventions targeting the specific attentional networks remain lacking. Transcranial direct current stimulation (tDCS) has been shown to modulate cortical excitability, which potentially serves as an interventional tool to treat individuals with attention impairment. The purpose of this study was to examine the effects of applying tDCS over the right posterior parietal cortex (PPC) on the performance of the three attentional networks. Twenty-six healthy young adults performed the Attention Network Test before and after anodal or sham tDCS stimulation over the right PPC. The alerting, orienting, and executive effects were assessed before and after the stimulation. The results demonstrated that the orienting effect was significantly improved after real tDCS relative to sham, whereas the alerting and executive control effects remained unaffected. Consistent with previous clinical and functional imaging studies, this suggests that the right PPC is actively engaged with the spatial orienting of attention. ? 2019 Federation of European Neuroscience Societies and John Wiley & Sons Ltd","adult; article; attention; clinical article; executive function; female; human; human experiment; male; posterior parietal cortex; transcranial direct current stimulation; young adult"
"Antitumor effect of kurarinone and underlying mechanism in small cell lung carcinoma cells",2019,"Background: Kurarinone, a prenylated flavonone isolated from the roots of Sophora flavescens, is known to be cytotoxic against many human cancer cells but not human small cell lung carcinoma (SCLC) yet. Also, the exact molecular mechanism of kurarinone for induction cytotoxicity remains unknown. Material and methods: We investigated the effects of kurarinone on cell proliferation, apoptosis, and migration in H1688 SCLC cells. Cell viability was determined by the MTT assay. Apoptotic indices such as cell cycle, mitochondrial membrane potential, cytochrome c release, caspase activity, and death receptors were evaluated by flow cytometry. Transwell migration and invasion assays were also included. Results: Our results indicated that kurarinone significantly decreased H1688 cell viability and induced the accumulation of sub-G1 fractions by activating caspase-3,-9, and PARP cleavage accompanied by the elevated release of cytochrome c and mitochondrial dysfunction in H1688 cells. Additionally, kurarinone promoted Fas and TRAIL receptor-1 and-2 expression via the caspase-8/Bid pathway, suggesting that kurarinone triggered apoptosis via the mitochondria-mediated and receptor-mediated apoptotic pathways. We also observed that kurarinone repressed migration and invasion capabilities of SCLC cells by suppressing the expression of epithelial-mesenchymal transition-related proteins and matrix metalloproteinases. Conclusion: Our findings provided evidence that kurarinone can induce apoptosis in SCLC cells via multiple mechanisms and delayed the cell migration and invasion of SCLC cells. ? 2019 Chung et al.","caspase; caspase 3; caspase 8; caspase 9; cytochrome c; death receptor; death receptor 4; death receptor 5; kurarinone; matrix metalloproteinase; nicotinamide adenine dinucleotide adenosine diphosphate ribosyltransferase; tumor necrosis factor receptor superfamily member 6; antineoplastic activity; apoptosis; Article; cell cycle; cell invasion; cell migration; cell migration assay; cell proliferation; cell viability; controlled study; disorders of mitochondrial functions; drug mechanism; enzyme activity; epithelial mesenchymal transition; flow cytometry; human; human cell; lung small cell carcinoma cell line; mitochondrial membrane potential; MTT assay; NCI-H1688 cell line; protein expression; protein metabolism; protein secretion; signal transduction"
"DOX/ICG-carrying γ-PGA-g-PLGA-based polymeric nanoassemblies for acid-triggered rapid DOX release combined with NIR-activated photothermal effect",2019,"To boost the efficacy of chemo-photothermal cancer treatment by the intracellular rapid release of doxorubicin (DOX) combined with near-infrared (NIR)-triggered photothermal effect of indocyanine green (ICG), the poly(γ-glutamic acid)-g-poly(lactic-co-glycolic acid) (γ-PGA-g-PLGA)-based polymeric nanoassemblies (PNAs) with simultaneous incorporation of DOX and ICG were developed in this work by simple one-step nanoprecipitation. The obtained DOX/ICG-loaded PNAs were characterized by a compact γ-PGA/DOX complexes-encapsulated PLGA-rich core covered with the co-assembly of amphiphilic D-α-tocopheryl polyethylene glycol succinate (TPGS), 1,2-distearoyl-sn-glycero-3-phosphoethanolamine-N-[amino(polyethylene glycol)] (DSPE-PEG) and ICG molecules. The robust cargo-loaded PNAs not only promoted the photo-stability of ICG in PBS, but also reduced ICG leakage from PNAs. With the milieu pH being altered from 7.4 to 5.0, the massive disruption of ionic DOX/γ-GA complexes and PLGA degradation considerably accelerated DOX release from payload-containing PNAs. The results of in vitro cellular uptake revealed that the DOX/ICG-loaded PNAs appreciably enhanced the cellular uptake of payloads by HeLa cells. Notably, through the intracellular acid-triggered rapid DOX release combined with the ICG-based NIR-activated hyperthermia and singlet oxygen generation, the combination therapy of DOX/ICG-loaded PNAs can use lower dosage of drugs to effectively inhibit proliferation of HeLa cells compared to the chemo or photothermal treatment alone, thus showing the great potential to improve efficacy of cancer treatment. ? 2018 Elsevier Ltd","Amino acids; Controlled drug delivery; Diseases; Drug dosage; Gas generators; Hyperthermia therapy; Infrared devices; Polyethylene glycols; Polyethylenes; Targeted drug delivery; Amphiphilic graft copolymers; Combination therapy; Intracellular drug delivery; Nano-assemblies; Photo-thermal; Photothermal effects; Poly lactic-co-glycolic acid; Singlet oxygen generation; Lanthanum compounds"
"TNF-α-induced miR-450a mediates TMEM182 expression to promote oral squamous cell carcinoma motility",2019,"Distant metastasis leads oral cancer patients into a poor survival rate and a high recurrence stage. During tumor progression, dysregulated microRNAs (miRNAs) have been reported to involve tumor initiation and modulate oral cancer malignancy. MiR-450a was significantly upregulated in oral squamous cell carcinoma (OSCC) patients without functional reports. This study was attempted to uncover the molecular mechanism of novel miR-450a in OSCC. Mir-450a expression was examined by quantitative RT-PCR, both in OSCC cell lines and patients. Specific target of miR-450a was determined by software prediction, luciferase reporter assay, and correlation with target protein expression. The functions of miR-450a and TMEM182 were accessed by adhesion and transwell invasion analyses. Determination of the expression and cellular localization of TMEM182 was examined by RT-PCR and by immunofluorescence staining. The signaling pathways involved in regulation of miR-450a were investigated using the kinase inhibitors. Overexpression of miR-450a in OSCC cells impaired cell adhesion ability and induced invasiveness, which demonstrated the functional role of miR-450a as an onco-miRNA. Interestingly, tumor necrosis factor alpha (TNF-α)-mediated expression of TMEM182 was regulated by miR-450a induction. MiR-450a-reduced cellular adhesion was abolished by TMEM182 restoration. Furthermore, the oncogenic activity of TNF-α/miR-450a/TMEM182 axis was primarily through activating extracellular signal–regulated kinase 1/2 (ERK1/2) signaling pathway. ERK1/2 inhibitor prevented the TNF-α-induced miR-450a expression and enhanced adhesion ability. Our data suggested that TNF-α-induced ERK1/2-dependent miR-450a against TMEM182 expression exerted a great influence on increasing OSCC motility. Overall, our results provide novel molecular insights into how TNF-α contributes to oral carcinogenesis through miR-450a that targets TMEM182. ? 2019 Hsing et al. This is an open access article distributed under the terms of the Creative Commons Attribution License, which permits unrestricted use, distribution, and reproduction in any medium, provided the original author and source are credited.","1,4 diamino 1,4 bis(2 aminophenylthio) 2,3 dicyanobutadiene; 2 (2 amino 3 methoxyphenyl)chromone; 4 (4 fluorophenyl) 2 (4 methylsulfinylphenyl) 5 (4 pyridyl)imidazole; microRNA; microRNA 450a; mitogen activated protein kinase 1; mitogen activated protein kinase 3; tumor necrosis factor; unclassified drug; membrane protein; microRNA; MIRN450 microRNA, human; tumor necrosis factor; 3' untranslated region; antineoplastic activity; Article; cell adhesion; cell invasion; cell motility; cellular distribution; controlled study; down regulation; gene control; gene expression; gene function; gene targeting; human; human cell; oncogene; oral squamous cell carcinoma cell line; protein expression; signal transduction; TMEM182 gene; adult; aged; cell motion; female; genetics; male; MAPK signaling; metabolism; middle aged; mouth tumor; pathology; physiology; squamous cell carcinoma; tumor cell line; tumor invasion; Adult; Aged; Carcinoma, Squamous Cell; Cell Adhesion; Cell Line, Tumor; Cell Movement; Female; Humans; Male; MAP Kinase Signaling System; Membrane Proteins; MicroRNAs; Middle Aged; Mouth Neoplasms; Neoplasm Invasiveness; Tumor Necrosis Factor-alpha"
"Maslinic acid enhances immune responses in leukemic mice through macrophage phagocytosis and natural killer cell activities in vivo",2019,"Background/Aim: Maslinic acid (MA), a pentacyclic triterpene extracted from wax-like coatings of olives, has been shown to reduce cancer cell number through induction of autophagy and apoptosis in many human cancer cells including human leukemia HL-60 cells. In the present study, we investigated whether or not MA affects immune responses in a leukemia mouse model. Materials and Methods: WEHI-3 cells were intraperitonealIy (i.p.) injected into normal BALB/c mice to develop leukemia. Mice were then treated by i.p. injection with MA at different doses (0, 8, 16 and 32 mg/kg) for 2 weeks. After treatment, all animals were weighed and blood, liver and spleen tissues were weighed. Blood or spleen both were used for determination of cell markers or phagocytosis, natural killer (NK) cell activities and T- and B-cell proliferation, respectively, by using a flow cytometric assay. Results: MA did not significantly affect body, liver, and spleen weights. However, MA increased markers of T-cells (at 16 mg/kg treatment) and monocytes (at 32 mg/kg treatment), but reduced B-cell markers (at 8 mg/kg treatment); MA did not significantly affect cell marker of macrophages. Furthermore, MA increased phagocytosis by macrophages from peripheral blood mononuclear cells and peritoneal cavity at 32 mg/kg treatment and increased NK cell activity at target cell:splenocyte ratio of 25:1 but did not affect B- and T-cell proliferation. Conclusion: MA increased immune responses by enhancing macrophage phagocytosis and NK cell activities in leukemic mice. ? 2019 International Institute of Anticancer Research. All rights reserved.","maslinic acid; retinoic acid; maslinic acid; triterpene; animal cell; animal experiment; animal model; animal tissue; antileukemic activity; Article; B lymphocyte; body weight; controlled study; immune response; in vivo study; leukemia; leukocyte; liver tissue; liver weight; macrophage; male; monocyte; mouse; natural killer cell; nonhuman; peripheral blood mononuclear cell; peritoneal cavity; phagocytosis; spleen cell; spleen tissue; spleen weight; T lymphocyte; treatment duration; animal; cytotoxicity; disease model; drug effect; human; immunology; leukemia; lymphocyte activation; macrophage; mononuclear cell; natural killer cell; pathology; phagocytosis; spleen; Animals; B-Lymphocytes; Cytotoxicity, Immunologic; Disease Models, Animal; Humans; Killer Cells, Natural; Leukemia; Leukocytes, Mononuclear; Lymphocyte Activation; Macrophages; Mice; Phagocytosis; Spleen; T-Lymphocytes; Triterpenes"
"Lymphatic vessel remodeling and invasion in pancreatic cancer progression",2019,"Background: The lymphatic system is involved in metastasis in pancreatic cancer progression. In cancer staging, lymphatic spread has been used to assess the invasiveness of tumor cells. However, from the endothelium's perspective, the analysis downplays the peri-lesional activities of lymphatic vessels. This unintended bias is largely due to the lack of 3-dimensional (3-D) tissue information to depict the lesion microstructure and vasculature in a global and integrated fashion. Methods: We targeted the pancreas as the model organ to investigate lymphatic vessel remodeling in cancer lesion progression. Transparent pancreases were prepared by tissue clearing to facilitate deep-tissue, tile-scanning microscopy for 3-D lymphatic network imaging. Findings: In human pancreatic ductal adenocarcinoma, we identify the close association between the pancreatic intraepithelial neoplasia (PanIN) lesions and the lymphatic network. In mouse models of PanIN (elastase-CreER;LSL-KrasG12D and elastase-CreER;LSL-KrasG12D;p53+/?), the 3-D image data reveal the peri-lesional lymphangiogenesis, endothelial invagination, formation of the bridge/valve-like luminal tubules, vasodilation, and luminal invasion. In the orthotopic mouse model of pancreatic cancer, we identify the localized, graft-induced lymphangiogenesis and the peri- and intra-tumoral lymphatic vessel invasion. Interpretation: The integrated view of duct lesions and vascular remodeling suggests an active role, rather than a passive target, of lymphatic vessels in the metastasis of pancreatic cancer. Our 3-D image data provide insights into the pancreatic cancer microenvironment and establish the technical and morphological foundation for systematic detection and 3-D analysis of lymphatic vessel invasion. Fund: Taiwan Academia Sinica (AS-107-TP-L15 and AS-105-TP-B15), Ministry of Science and Technology (MOST 106-2321-B-001-048, 106-0210-01-15-02, 106-2321-B-002-034, and 106-2314-B-007-004-MY2), and Taiwan National Health Research Institutes (NHRI EX107-10524EI). ? 2019","cre recombinase; elastase; K ras protein; aged; animal cell; animal experiment; animal model; animal tissue; Article; blood vessel reactivity; cancer growth; cancer staging; carcinogenesis; comparative study; controlled study; female; human; human tissue; lymphangiogenesis; lymphatic vessel remodeling; major clinical study; male; mouse model; nonhuman; pancreas adenocarcinoma; pancreas adenoma; pancreatectomy; priority journal; quantitative analysis; scanning electron microscopy; three dimensional imaging; tumor invasion; tumor microenvironment; tumor vascularization; vascular remodeling"
