"文獻名稱.","年份","摘要","索引關鍵字"
"A virtual laboratory for learning fullerene production and nanostructure analysis",2019,"Nanotechnology is an emerging technology and it brings a tremendous change to human life and economy. When the size of a material is reduced to the nanoscale, its properties may change significantly and becomes a new substance. A fullerene is a molecule of carbon in the shape of a hollow sphere, ellipsoid, tube, and many other geometrical structures. For example, buckyballs are spherical fullerenes and carbon nanotubes are cylindrical fullerenes. Fullerenes have been under intensive investigation for their expanding applications in electronics, energy, medicine, and many other research fields. Nanostructure analysis is very important for understanding the formation of different materials and their properties. In this study, a virtual laboratory is developed for learning fullerene production and its nanostructure analysis. The learners can use the arc discharge equipment to produce fullerenes and then use the transmission electron microscope (TEM) to observe the nanostructures of different fullerene samples. The high interactivity and 3D visual effects of the virtual laboratory enable the learners to become familiar with the geometrical structures and properties of fullerenes. A teaching experiment has been conducted and the results show that the virtual laboratory can improve their learning motivation and effectiveness. ? 2018 Wiley Periodicals, Inc.","E-learning; Geometry; Laboratories; Nanotechnology; Transmission electron microscopy; Virtual reality; Yarn; Arc discharge; Emerging technologies; Fullerene production; Geometrical structure; Learning motivation; Nanostructure analysis; Spherical fullerenes; Virtual laboratories; Fullerenes"
"The stability and immunogenicity of inactivated MDCK cell-derived influenza H7N9 viruses",2019,"In recent years, cell-based influenza vaccines have gained a great interest over the egg-based vaccines. Several inactivated H7N9 vaccines have been evaluated in clinical trials, including whole-virion vaccines, split vaccines and subunit vaccines. Recently, we developed a new suspension MDCK (sMDCK) cell line for influenza viruses production. However, the properties of purified antigen from sMDCK cells remain unclear. In this study, the stability of influenza H7N9 vaccine bulk derived from sMDCK cells was investigated, and the data were compared with the vaccine antigen derived from our characterized adhesion MDCK (aMDCK) cells in serum-free medium. The influenza H7N9 bulks derived from sMDCK and aMDCK cells were stored at 2–8 °C for different periods of time, and a number of parameters selected to monitor the H7N9 vaccine antigen stability were evaluated at each interval (1, 3 and 12 months). The monitored parameters included virus morphology, hemagglutinin (HA) activity, HA concentration, antigenicity, and immunogenicity. The sMDCK-derived H7N9 bulk showed similar morphology to that of the aMDCK-derived H7N9 bulk, and there were no obvious changes after the extended storage periods. Furthermore, the HA titer, HA concentration, and antigenicity of sMDCK-derived H7N9 bulk were stable after 28 months of storage. Finally, the results of hemagglutination inhibition and neutralization tests showed that sMDCK- and aMDCK-derived H7N9 vaccines had comparable immunogenicity. These results indicated that sMDCK-derived H7N9 bulk has good stability compared to that of aMDCK-derived H7N9 bulk. Thus, the newly developed suspension MDCK cell line shows a great alternative for manufacturing cell-based influenza vaccines. ? 2019 The Authors","aluminum hydroxide; influenza vaccine; Influenza virus hemagglutinin; adjuvant therapy; animal experiment; antigenicity; Article; cell suspension; controlled study; drug stability; female; hemagglutination inhibition test; immunogenicity; Influenza A virus (H7N9); MDCK cell line; mouse; nonhuman; priority journal; virus neutralization; virus particle"
"Metformin was associated with lower all-cause mortality in type 2 diabetes with acute coronary syndrome: A Nationwide registry with propensity score-matched analysis",2019,"Background: No randomized controlled trials evaluating metformin therapy efficacy in patients with type 2 diabetes mellitus (DM) and acute coronary syndrome (ACS) have been reported. We aimed to examine the mortality benefit of metformin therapy in patients with type 2 DM and ACS, compared with non-metformin anti-diabetes agents users. Methods: Data were extracted from the prospective nationwide ACS-DM Taiwan Society of Cardiology registry. Propensity score (PS) matching on baseline characteristics and treatment measures was performed for metformin versus non-metformin users. The Cox proportional hazards model was used to compare mortality outcomes among the PS-matched cohort as the primary analysis. The Cox proportional hazards models adjusting for all pre-determined covariates and quintiles of the PS among the overall population were performed as the secondary analyses. Results: Of 1157 patients with type 2 DM and ACS receiving anti-diabetes agents, 78 patients (6.7%) died over the 2-year follow-up period. After PS matching, 318 metformin users were matched with 318 non-metformin users. Metformin users had a lower all-cause mortality rate (adjusted hazard ratio [aHR] 0.50, 95% confidence interval [CI] 0.26–0.95) in the primary analysis. The survival benefit of metformin therapy was consistent in the secondary analyses (aHR 0.30, 95% CI 0.17–0.54 while adjusting for all pre-determined covariates, and aHR 0.34, 95% CI 0.19–0.59 while adjusting for quintiles of the PS). Conclusions: Among patients with type 2 DM and ACS, metformin was associated with lower all-cause mortality. However, a detrimental effect of any of the comparators could not be excluded. ? 2019 Elsevier B.V.","angiotensin receptor antagonist; antithrombocytic agent; beta adrenergic receptor blocking agent; dipeptidyl carboxypeptidase inhibitor; hydroxymethylglutaryl coenzyme A reductase inhibitor; inotropic agent; insulin; metformin; oral antidiabetic agent; acute coronary syndrome; adult; all cause mortality; Article; cardiology; clinical feature; clinical outcome; cohort analysis; controlled study; disease registry; drug efficacy; female; follow up; human; major clinical study; male; medical society; monotherapy; mortality; mortality rate; non insulin dependent diabetes mellitus; outcome assessment; priority journal; propensity score; Taiwan; treatment response"
"An integrated self-driven microfluidic device for rapid detection of the influenza A (H1N1) virus by reverse transcription loop-mediated isothermal amplification",2019,"Influenza A is amongst the most infectious diseases of the past decade. Although rapid and accurate detection can efficiently prevent its spread, the sensitivity and specificity of current rapid influenza diagnostic tests (RIDTs) are relatively low. In this study, a self-driven microfluidic device was developed to rapidly detect the H1N1 influenza virus via a reverse transcription loop-mediated isothermal amplification (RT-LAMP) assay. The device was capable of 1) virus isolation via H1N1-specific aptamers conjugated magnetic beads, 2) virus lysis, 3) isothermal nucleic acid amplification, and 4) colorimetric detection of the virus. The limit of detection was measured to be only 3 × 10?4 hemagglutinating units (HAU)/reaction, which is sensitive enough for clinical applications. The entire procedure could be performed in only 40 min by capillary forces through a novel polydimethylsiloxane surface treatment in cooperation with hydrophobic soft valves. This is the first time that a simple, self-driven passive microfluidic chip has been demonstrated to be capable of performing sample pretreatment, RT-LAMP, and H1N1 virus detection on a single chip. This microfluidic chip may therefore serve a promising RIDT with high sensitivity and high specificity for point-of-care diagnostics in the near future. ? 2019 Elsevier B.V.","Diagnosis; Fluidic devices; Isotherms; Nucleic acids; Silicones; Surface treatment; Transcription; Viruses; Capillary-driven; Colorimetric detection; Diagnostic tests; Influenza A; Loop mediated isothermal amplifications; Micro-fluidic devices; Point of care diagnostic; Sensitivity and specificity; Microfluidics"
"Relationship between body mass index, antidiabetic agents, and midterm mortality in patients with both type 2 diabetes mellitus and acute coronary syndrome",2019,"Background-The aim of this study was to determine the influence of various antidiabetic therapies on the relationship between body mass index and all-cause mortality in patients with diabetes mellitus and acute coronary syndrome. Methods and Results-This was a prospective, observational study comprising 1193 patients diagnosed with type 2 diabetes mellitus and acute coronary syndrome. The patients were stratified into 4 body mass index categories, and their mortality rates were compared using time-dependent Cox regression analysis using normal weight (body mass index, 18.5-23.9) as the reference. Subsequently, the influence of antidiabetic therapies on the association between BMI and mortality were analyzed. Seventy-four patients (6.2%) died over 2 years of follow-up. The mortality rate was lowest in the class I obese group (3.35%) and highest in the normal-weight group (9.67%). After adjusting for covariates, class I obesity paradoxically remained significantly protective against mortality compared with normal weight (hazard ratio, 0.141; P=0.049); interaction term analysis showed that insulin therapy influenced this “obesity paradox” (P=0.045). When the patients were stratified by insulin use, the protective effect of obesity disappeared in the insulin-treated patients but persisted in the non-insulin-treated patients. Conclusions-In patients with type 2 diabetes mellitus and acute coronary syndrome, the relationship between body mass index and mortality rate is U-shaped, with class I obesity representing the nadir and normal weight the peak. The protective effect of obesity disappeared in patients treated with insulin. ? 2019 The Authors.","angiotensin 2 receptor antagonist; antidiabetic agent; antithrombocytic agent; beta adrenergic receptor blocking agent; dipeptidyl carboxypeptidase inhibitor; dipeptidyl peptidase IV inhibitor; hydroxymethylglutaryl coenzyme A reductase inhibitor; insulin; insulin sensitizing agent; meglitinide; metformin; pioglitazone; sulfonylurea; acute coronary syndrome; adult; adverse outcome; aged; all cause mortality; Article; body mass; body weight; cohort analysis; controlled study; disease association; drug use; female; follow up; human; insulin treatment; major clinical study; male; mortality rate; non insulin dependent diabetes mellitus; obesity; observational study; priority journal; prospective study; treatment response"
"Graphene Quantum Dots Decorated Gold-Polyaniline Nanowire for Impedimetric Detection of Carcinoembryonic Antigen",2019,"A label-free impedimetric immunosensor based on N, S-graphene quantum dots@Au-polyaniline (N, S-GQDs@Au-PANI) nanowires was fabricated for the quantitative detection of carcinoembryonic antigen (CEA). The N, S-GQDs and Au-PANI were synthesized by a simple hydrothermal pyrolysis and interfacial polymerization, respectively. Subsequently, 2–9 nm N, S-GQDs are successfully decorated onto 30–50 nm Au-PANI nanowires by Au-thiol linkage to serve as the bifunctional probe for amplifying the electrochemical activity as well as anchoring anti-CEA. The N, S-GQDs@Au-PANI nanowires are excellent conducting materials to accelerate the electron transfer, while the formation of CEA antibody-antigen bioconjugates after the addition of CEA significantly increase the charge transfer resistance, and subsequently provides a highly stable and label-free immunoassay platform for the impedimetric detection of CEA. The label-free immunosensor exhibits a wide linear range from 0.5 to 1000 ng mL ?1 with a low detection limit of 0.01 ng mL ?1 . The N, S-GQDs@Au-PANI based immunosensor also shows high selectivity and stability over other cancer makers and amino acids. Moreover, this promising platform is successfully applied to the detection of CEA in human serum samples with excellent recovery of (96.0 ± 2.6)–(103 ± 3.8)%. These results clearly demonstrate a newly developed highly efficient and label-free impedimetric immunosensor for the detection of CEA using N, S-GQDs@Au-PANI nanowires as the biosensing probe, which can pave the gateway for the fabrication of high performance and robust impedimetric immunosensor to detect cancer makers in early stage of cancer diagnosis and therapy. ? 2019, The Author(s).",""
"Aerosol delivery into small anatomical airway model through spontaneous engineered breathing",2019,"Pulmonary administration is a noninvasive drug delivery method that, in contrast to systemic administration, reduces drug dosage and possible side effects. Numerous testing models, such as impingers and impactors, have previously been developed to evaluate the fate of inhaled drugs. However, such models are limited by the lack of information regarding several factors, such as pulmonary morphology and breathing motion, which are required to fully interpret actual inhaled-drug deposition profiles within the human respiratory tract. In this study, a spontaneous breathing-lung model that integrates branched morphology and deformable alveolar features was constructed using a multilayered fabrication technology to mimic the complex environment of the human lower respiratory tract. The developed model could emulate cyclic and spontaneous breathing motions to inhale and exhale aerosols generated by a nebulizer under diseaselike conditions. Results of this research demonstrate that aerosols (4.2 μm) could reach up to the deeper lung regions (generation 19 of the branched lung structure) within the obstructivelike model, whereas lesser penetration (generation 17) was observed when using the restrictivelike model. The proposed breathing-lung model can serve as a testing platform to provide a comprehensive understanding of the pharmacokinetics of pulmonary drugs within the lower lungs. ? 2019 Author(s).","Aerosols; Biological organs; Controlled drug delivery; Drug dosage; Drug interactions; Morphology; Targeted drug delivery; Breathing motions; Complex environments; Fabrication Technologies; Human respiratory tract; Pulmonary administrations; Spontaneous breathing; Systemic administration; Testing platforms; Physiological models"
"Citronellol induces necroptosis of human lung cancer cells via TNF-α pathway and reactive oxygen species accumulation",2019,"Background/Aim: Our current study aimed to determine the molecular mechanisms of citronellol-induced cell death and ROS accumulation in non-small cell lung cancer (NCI-H1299 cells) and also compare the anticancer effects of citronellol and EOPC. Materials and Methods: ROS measurement and western blotting were performed to detect whether citronellol can induce necroptosis in vitro. Besides, we performed an in vivo analysis of tumourigenesis inhibition by citronellol treatment in BALB/c (nu/nu) nude mice. Results: Necroptosis occured by up-regulating TNF-?, RIP1/RIP3 activities, and down-regulating caspase-3/caspase-8 activities after citronellol treatment in NCI-H1299 cells. Citronellol also resulted in a biphasic increase in ROS production at 1 h and at 12 h in NCI-H1299 cells. Xenograft model experiments showed that citronellol could effectively inhibit subcutaneous tumours produced 4 weeks after intraperitoneal injection of NCI-H1299 in BALB/c nude mice. Conclusion: Citronellol induced necroptosis of NCI-H1299 cells via TNF-? pathway and ROS accumulation. ? 2019 International Institute of Anticancer Research. All rights reserved.","caspase 3; caspase 8; cathepsin B; citronellol; cyclin D; cyclin dependent kinase 2; cyclin E; DNA ligase; parp protein; protein; reactive oxygen metabolite; rip1 protein; rip3 protein; tumor necrosis factor; unclassified drug; citronellol; reactive oxygen metabolite; tumor necrosis factor; A-549 cell line; antineoplastic activity; Article; BT-20 cell line; cell cycle; cell death; cell viability; controlled study; down regulation; drug cytotoxicity; enzyme activity; flow cytometry; human; human cell; IC50; in vitro study; MCF-10A cell line; mouse; MTT assay; NCI-H1299 cell line; NCI-H23 cell line; necroptosis; nonhuman; protein expression; signal transduction; tumor volume; tumor xenograft; upregulation; Western blotting; animal; disease model; dose response; drug effect; drug screening; lung tumor; metabolism; necroptosis; pathology; pharmacology; signal transduction; tumor cell line; Acyclic Monoterpenes; Animals; Cell Line, Tumor; Disease Models, Animal; Dose-Response Relationship, Drug; Humans; Lung Neoplasms; Mice; Necroptosis; Reactive Oxygen Species; Signal Transduction; Tumor Necrosis Factor-alpha; Xenograft Model Antitumor Assays"
"Ampelopsins A and C Induce Apoptosis and Metastasis through Downregulating AxL, TYRO3, and FYN Expressions in MDA-MB-231 Breast Cancer Cells",2019,"Ampelopsins A and C are resveratrol oligostilbenes whose role in cancer development remains unknown. This study evaluated the antimetastatic and apoptosis-inducing properties of ampelopsins A and C in MDA-MB-231 cells. The IC 50 values of ampelopsins A and C against MDA-MB-231 cells at 72 h were 38.75 ± 4.61 and 2.71 ± 0.21 μM, respectively. However, at 24 h, ampelopsins A and C decreased cell metastasis significantly. Among the 71 proteins present on the human phosphoreceptor tyrosin kinase array, ampelopsin C decreased the phosphorylated protein level of AXL, Dtk (TYRO3), EphA2, EphA6, Fyn, Hck, and SRMS. Additionally, antiproliferation effects of ampelopsin C were enhanced when combined with luteolin and chrysin compared to either two or a single agent in MDA-MB-231 cells. Overall, ampelopsins A and C extracted from Vitis thunbergii are both novel antimetastatic agents and potential therapeutic targets in patients with breast cancer. ? 2019 American Chemical Society.","Cell death; Flavonoids; Pathology; Proteins; ampelopsin A; Antiproliferation; Breast cancer cells; Cancer development; MDA-MB-231; Mda-mb-231 cells; Phosphorylated proteins; Therapeutic targets; Diseases; ampelopsin; antineoplastic agent; axl receptor tyrosine kinase; flavonoid; FYN protein, human; oncoprotein; protein kinase Fyn; protein tyrosine kinase; TYRO3 protein, human; apoptosis; breast tumor; cell proliferation; down regulation; drug effect; female; genetics; human; metabolism; metastasis; pathophysiology; phosphorylation; tumor cell line; Antineoplastic Agents; Apoptosis; Breast Neoplasms; Cell Line, Tumor; Cell Proliferation; Down-Regulation; Female; Flavonoids; Humans; Neoplasm Metastasis; Phosphorylation; Proto-Oncogene Proteins; Proto-Oncogene Proteins c-fyn; Receptor Protein-Tyrosine Kinases"
"Simultaneous detection of multiple NT-proBNP clinical samples utilizing an aptamer-based sandwich assay on an integrated microfluidic system",2019,"Although cardiovascular diseases such as heart failure (HF) affect 30 million people globally, the early detection of HF has, until recently, been difficult and prone to misdiagnoses. Monitoring the circulatory levels of a relatively new biomarker, the N-terminal prohormone of a B-type natriuretic peptide, could be used for early risk evaluation of HF. Therefore, we developed a pneumatically-driven, automatic integrated microfluidic platform equipped with micromixers, micropumps, and microvalves for the simultaneous detection of NT-proBNP in up to six clinical samples within 25 min by using a novel aptamer-based sandwich assay, and the limit of detection was only 1.53 pg mL-1; given that the chip is 64% more compact than those developed in our prior works and requires only 5 μL of sample input, it may serve as a promising tool for early diagnosis of HF. ? The Royal Society of Chemistry.","amino terminal pro brain natriuretic peptide; aptamer; aptamer; brain natriuretic peptide; peptide fragment; pro-brain natriuretic peptide (1-76); Article; calibration; controlled study; limit of detection; microfluidics; microtechnology; priority journal; protein analysis; devices; equipment design; genetic procedures; genetics; human; lab on a chip; metabolism; nucleotide sequence; system analysis; time factor; Aptamers, Nucleotide; Base Sequence; Biosensing Techniques; Calibration; Equipment Design; Humans; Lab-On-A-Chip Devices; Limit of Detection; Natriuretic Peptide, Brain; Peptide Fragments; Systems Integration; Time Factors"
"Cordycepin suppresses endothelial cell proliferation, migration, angiogenesis, and tumor growth by regulating focal Adhesion Kinase and p53",2019,"Focal adhesion kinase (FAK) plays an important role in vascular development, including the regulation of endothelial cell (EC) adhesion, migration, proliferation, and survival. 3’-deoxyadenosine (cordycepin) is known to suppress FAK expression, cell migration, and the epithelial–mesenchymal transition in hepatocellular carcinoma (HCC). However, whether cordycepin affects FAK expression and cellular functions in ECs and the specific molecular mechanism remain unclear. In this study, we found that cordycepin suppressed FAK expression and the phosphorylation of FAK (p-FAK) at Tyr397 in ECs. Cordycepin inhibited the proliferation, wound healing, transwell migration, and tube formation of ECs. Confocal microscopy revealed that cordycepin significantly reduced FAK expression and decreased focal adhesion number of ECs. The suppressed expression of FAK was accompanied by induced p53 and p21 expression in ECs. Finally, we demonstrated that cordycepin suppressed angiogenesis in an in vivo angiogenesis assay and reduced HCC tumor growth in a xenograft nude mice model. Our study indicated that cordycepin could attenuate cell proliferation and migration and may result in the impairment of the angiogenesis process and tumor growth via downregulation of FAK and induction of p53 and p21 in ECs. Therefore, cordycepin may be used as a potential adjuvant for cancer therapy. ? 2019 by the authors. Licensee MDPI, Basel, Switzerland.","bortezomib; cordycepin; focal adhesion kinase; protein p21; protein p53; angiogenesis; animal cell; animal experiment; animal model; antiangiogenic activity; Article; carcinogenesis; cell migration; cell proliferation; confocal microscopy; controlled study; down regulation; endothelium cell; focal adhesion; human; human cell; in vivo study; liver cell carcinoma; mouse; nonhuman; protein expression; protein phosphorylation; tumor growth; wound healing"
"Engineered resistance to Zika virus in transgenic Aedes aegypti expressing a polycistronic cluster of synthetic small RNAs",2019,"Recent Zika virus (ZIKV) outbreaks have highlighted the necessity for development of novel vector control strategies to combat arboviral transmission, including genetic versions of the sterile insect technique, artificial infection with Wolbachia to reduce population size and/or vectoring competency, and gene drive-based methods. Here, we describe the development of mosquitoes synthetically engineered to impede vector competence to ZIKV. We demonstrate that a polycistronic cluster of engineered synthetic small RNAs targeting ZIKV is expressed and fully processed in Aedes aegypti, ensuring the formation of mature synthetic small RNAs in the midgut where ZIKV resides in the early stages of infection. Critically, we demonstrate that engineered Ae. aegypti mosquitoes harboring the anti-ZIKV transgene have significantly reduced viral infection, dissemination, and transmission rates of ZIKV. Taken together, these compelling results provide a promising path forward for development of effective genetic-based ZIKV control strategies, which could potentially be extended to curtail other arboviruses. ? 2019 National Academy of Sciences. All Rights Reserved.","RNA; small RNA; unclassified drug; Aedes aegypti; Article; controlled study; experimental organism; heterozygosity; homozygosity; host resistance; nonhuman; priority journal; promoter region; protein engineering; real time polymerase chain reaction; transgenic organism; urbanization; virus replication; virus strain; virus titration; virus transmission; Wolbachia; Zika virus; animal; epidemic; genetics; human; mosquito vector; pathogenicity; saliva; transgenic animal; transmission; virology; virus load; Zika fever; Zika virus; Animals; Animals, Genetically Modified; Disease Outbreaks; Humans; Mosquito Vectors; Saliva; Viral Load; Wolbachia; Zika Virus; Zika Virus Infection"
