"文獻名稱.","年份","摘要","索引關鍵字"
"Increased brain entropy of resting-state fMRI mediates the relationship between depression severity and mental health-related quality of life in late-life depressed elderly",2019,"Background: Entropy analysis is a computational method used to quantify the complexity in a system, and loss of brain complexity is hypothesized to be related to mental disorders. Here, we applied entropy analysis to the resting-state functional magnetic resonance imaging (rs-fMRI) signal in subjects with late-life depression (LLD), an illness combined with emotion dysregulation and aging effect. Methods: A total of 35 unremitted depressed elderly and 22 control subjects were recruited. Multiscale entropy (MSE) analysis was performed in the entire brain, 90 automated anatomical labeling-parcellated ROIs, and five resting networks in each study participant. Limitations: Due to ethical concerns, all the participants were under medication during the study. Results: Regionally, subjects with LLD showed decreased entropy only in the right posterior cingulate gyrus but had universally increased entropy in affective processing (putamen and thalamus), sensory, motor, and temporal nodes across different time scales. We also found higher entropy in the left frontoparietal network (FPN), which partially mediated the negative correlation between depression severity and mental components of the quality of life, reflecting the possible neural compensation during depression treatment. Conclusion: MSE provides a novel and complementary approach in rs-fMRI analysis. The temporal-spatial complexity in the resting brain may provide the adaptive variability beneficial for the elderly with depression. ? 2019","adult; aged; aging; Article; brain; clinical article; controlled study; emotion; entropy; female; frontoparietal cortex; functional magnetic resonance imaging; Geriatric Depression Scale; geriatric patient; human; late life depression; male; mental health; posterior cingulate; priority journal; putamen; quality of life; thalamus; brain; brain mapping; cingulate gyrus; depression; entropy; middle aged; nuclear magnetic resonance imaging; pathophysiology; physiology; procedures; psychology; quality of life; rest; antidepressant agent; Aged; Antidepressive Agents; Brain; Brain Mapping; Depressive Disorder; Entropy; Female; Gyrus Cinguli; Humans; Magnetic Resonance Imaging; Male; Mental Health; Middle Aged; Quality of Life; Rest; Thalamus"
"Relationship between self-identity confusion and internet addiction among college students: The mediating effects of psychological inflexibility and experiential avoidance",2019,"Internet addiction (IA) has become a major public health problem among college students. The aim of this study was to examine the relationship between self-identity confusion and IA and the mediating effects of psychological inflexibility and experiential avoidance (PI/EA) indicators in college students. A total of 500 college students (262 women and 238 men) were recruited. Their levels of self-identity were evaluated using the Self-Concept and Identity Measure. Their levels of PI/EA were examined using the Acceptance and Action Questionnaire-II. The severity of IA was assessed using the Chen Internet Addiction Scale. The relationships among self- identity, PI/EA, and IA were examined using structural equation modeling. The severity of self-identity confusion was positively associated with both the severity of PI/EA and the severity of IA. In addition, the severity of PI/EA indicators was positively associated with the severity of IA. These results demonstrated that the severity of self-identity confusion was related to the severity of IA, either directly or indirectly. The indirect relationship was mediated by the severity of PI/EA. Self-identity confusion and PI/EA should be taken into consideration by the community of professionals working on IA. Early detection and intervention of self-identity confusion and PI/EA should be the objectives for programs aiming to lower the risk of IA. ? 2019 by the authors. Licensee MDPI, Basel, Switzerland.","experimental study; Internet; psychology; public health; student; Acceptance and Action Questionnaire; adult; Article; avoidance behavior; college student; confusion; controlled study; experiential avoidance; female; human; internet addiction; major clinical study; male; psychological aspect; psychological inflexibility; psychological rating scale; questionnaire; risk reduction; self identity confusion; student attitude"
"Development of American-lineage influenza H5N2 reassortant vaccine viruses for pandemic preparedness",2019,"Novel low-pathogenic avian influenza (LPAI) H5N2 viruses hit poultry farms in Taiwan in 2003, and evolved into highly pathogenic avian influenza (HPAI) viruses in 2010. These viruses are reassortant viruses containing HA and NA genes from American-lineage H5N2 and six internal genes from local H6N1 viruses. According to a serological survey, the Taiwan H5N2 viruses can cause asymptomatic infections in poultry workers. Therefore, a development of influenza H5N2 vaccines is desirable for pandemic preparation. In this study, we employed reverse genetics to generate a vaccine virus having HA and NA genes from A/Chicken/CY/A2628/2012 (E7, LPAI) and six internal genes from a Vero cell-adapted high-growth H5N1 vaccine virus (Vero-15). The reassortant H5N2 vaccine virus, E7-V15, presented high-growth efficiency in Vero cells (512 HAU, 107.6 TCID50/mL), and passed all tests for qualification of candidate vaccine viruses. In ferret immunization, two doses of inactivated whole virus antigens (3 ?g of HA protein) adjuvanted with alum could induce robust antibody response (HI titre 113.14). In conclusion, we have established reverse genetics to generate a qualified reassortant H5N2 vaccine virus for further development. ? 2019 by the authors. Licensee MDPI, Basel, Switzerland.","adjuvant; american lineage H5N2 vaccine; avian influenza vaccine; hemagglutinin; live vaccine; plasma protein; unclassified drug; virus antigen; virus RNA; animal cell; animal experiment; animal model; antibody response; antigenicity; Article; asymptomatic infection; avian influenza; biosafety; chromatography; controlled study; densitometry; embryo; enzyme inhibition assay; female; gene overexpression; genetic reassortment; genetic stability; genetic transfection; hemagglutinin inhibition assay; ID50; immunization; immunodiffusion; Influenza A virus (H5N2); male; nonhuman; pandemic; pathogenicity; plasmid; poultry; reverse transcription polymerase chain reaction; sequence analysis; vaccination; Vero cell line; viral plaque assay; virus load; virus virulence"
"Selective targeting of DC-SIGN by controlling the oligomannose pattern on a polyproline tetra-helix macrocycle scaffold",2019,"DC-SIGN and langerin receptors both bind to oligomannose but lead to opposite effects upon encountering HIV. Because selective targeting of DC-SIGN can lead to anti-viral effects, we developed a glycoconjugate, which provides over 4800-fold selectivity for DC-SIGN over langerin, by controlling the oligomannose pattern on a polyproline tetra-helix macrocycle scaffold. ? 2019 The Royal Society of Chemistry.","DC SIGN lectin; glycoconjugate; lectin; macrocyclic compound; mannose oligosaccharide; polyproline tetra helix macrocycle scaffold; unclassified drug; antiviral activity; Article; binding kinetics; chemical modification; chemical structure; Human immunodeficiency virus; protein targeting"
"Ribose-5-phosphate isomerase A overexpression promotes liver cancer development in transgenic zebrafish via activation of ERK and β-catenin pathways",2019,"Dysregulation of the enzymes involved in the pentose phosphate pathway (PPP) is known to promote tumorigenesis. Our recent study demonstrated that ribose-5-phosphate isomerase (RPIA), a key regulator of the PPP, regulates hepatoma cell proliferation and colony formation. Our studies in zebrafish reveal that RPIA-mediated hepatocarcinogenesis requires extracellular signal-regulated kinase (ERK) and β-catenin signaling. To further investigate RPIA-mediated hepatocarcinogenesis, two independent lines of transgenic zebrafish expressing human RPIA in the liver were generated. These studies reveal that RPIA overexpression triggers lipogenic factor/enzyme expression, steatosis, fibrosis and proliferation of the liver. In addition, the severity of fibrosis and the extent of proliferation are positively correlated with RPIA expression levels. Furthermore, RPIA-mediated induction of hepatocellular carcinoma (HCC) requires the ERK and β-catenin signaling pathway but is not dependent upon transaldolase levels. Our study presents a mechanism for RPIA-mediated hepatocarcinogenesis and suggests that RPIA represents a valuable therapeutic target for the treatment of HCC. ? 2019 The Author(s).","beta catenin; isomerase; mitogen activated protein kinase; ribose 5 phosphate; animal experiment; animal model; animal tissue; Article; cancer growth; carcinogenesis; cell proliferation; comparative study; controlled study; enzyme activation; fatty liver; human; human cell; liver cell carcinoma; liver fibrosis; nonhuman; priority journal; real time polymerase chain reaction; reverse transcription polymerase chain reaction; signal transduction; transgenic zebrafish; xenotransplantation"
"Sialylation of vasorin by ST3Gal1 facilitates TGF-β1-mediated tumor angiogenesis and progression",2019,"ST3Gal1 is a key sialyltransferase which adds α2,3-linked sialic acid to substrates and generates core 1 O-glycan structure. Upregulation of ST3Gal1 has been associated with worse prognosis of breast cancer patients. However, the protein substrates of ST3Gal1 implicated in tumor progression remain elusive. In our study, we demonstrated that ST3GAL1-silencing significantly reduced tumor growth along with a notable decrease in vascularity of MCF7 xenograft tumors. We identified vasorin (VASN) which was shown to bind TGF-β1, as a potential candidate that links ST3Gal1 to angiogenesis. LC-MS/MS analysis of VASN secreted from MCF7, revealed that more than 80% of its O-glycans are sialyl-3T and disialyl-T. ST3GAL1-silencing or desialylation of VASN by neuraminidase enhanced its binding to TGF-β1 by 2- to 3-fold and thereby dampening TGF-β1 signaling and angiogenesis, as indicated by impaired tube formation of HUVECs, suppressed angiogenesis gene expression and reduced activation of Smad2 and Smad3 in HUVEC cells. Examination of 114 fresh primary breast cancer and their adjacent normal tissues showed that the expression levels of ST3Gal1 and TGFB1 were high in tumor part and the expression of two genes was positively correlated. Kaplan Meier survival analysis showed a significantly shorter relapse-free survival for those with lower expression VASN, notably, the combination of low VASN with high ST3GAL1 yielded even higher risk of recurrence (p = 0.025, HR = 2.967, 95% CI = 1.14–7.67). Since TGF-β1 is known to transcriptionally activate ST3Gal1, our findings illustrated a feedback regulatory loop in which TGF-β1 upregulates ST3Gal1 to circumvent the negative impact of VASN. ? 2018 The Authors. International Journal of Cancer published by John Wiley & Sons Ltd on behalf of UICC","membrane protein; short hairpin RNA; sialyltransferase; small interfering RNA; ST3 beta galactoside alpha 2,3 sialyltransferase 1; transforming growth factor beta1; unclassified drug; vasorin; beta-galactoside alpha-2,3-sialyltransferase; carrier protein; membrane protein; sialic acid derivative; sialyltransferase; TGFB1 protein, human; transforming growth factor beta1; VASN protein, human; animal experiment; animal model; animal tissue; Article; binding affinity; breast cancer; cancer growth; cancer recurrence; carcinogenesis; controlled study; female; gene expression; human; human cell; human tissue; immunohistochemistry; liquid chromatography-mass spectrometry; MCF-7 cell line; mouse; nonhuman; priority journal; protein binding; protein expression; protein protein interaction; protein secretion; quantitative analysis; recurrence free survival; recurrence risk; sialylation; signal transduction; transcription initiation; upregulation; animal; breast; breast tumor; disease exacerbation; drug screening; epidemiology; genetics; metabolism; mortality; neovascularization (pathology); pathology; survival analysis; tumor recurrence; umbilical vein endothelial cell; vascularization; Animals; Breast; Breast Neoplasms; Carrier Proteins; Disease Progression; Female; Human Umbilical Vein Endothelial Cells; Humans; MCF-7 Cells; Membrane Proteins; Mice; Neoplasm Recurrence, Local; Neovascularization, Pathologic; RNA, Small Interfering; Sialic Acids; Sialyltransferases; Signal Transduction; Survival Analysis; Transforming Growth Factor beta1; Up-Regulation; Xenograft Model Antitumor Assays"
"KDM4B is a coactivator of c-Jun and involved in gastric carcinogenesis",2019,"KDM4/JMJD2 Jumonji C-containing histone lysine demethylases (KDM4A–D) constitute an important class of epigenetic modulators in the transcriptional activation of cellular processes and genome stability. Interleukin-8 (IL-8) is overexpressed in gastric cancer, but the mechanisms and particularly the role of the epigenetic regulation of IL-8, are unclear. Here, we report that KDM4B, but not KDM4A/4C, upregulated IL-8 production in the absence or presence of Helicobacter pylori. Moreover, KDM4B physically interacts with c-Jun on IL-8, MMP1, and ITGAV promoters via its demethylation activity. The depletion of KDM4B leads to the decreased expression of integrin αV, which is exploited by H. pylori carrying the type IV secretion system, reducing IL-8 production and cell migration. Elevated KDM4B expression is significantly associated with the abundance of p-c-Jun in gastric cancer and is linked to a poor clinical outcome. Together, our results suggest that KDM4B is a key regulator of JNK/c-Jun-induced processes and is a valuable therapeutic target. ? 2019, The Author(s).","CD51 antigen; histone demethylase; histone lysine demethylase 4; histone lysine demethylase 4a; histone lysine demethylase 4b; histone lysine demethylase 4c; interleukin 8; interstitial collagenase; mitogen activated protein kinase 3; mitogen activated protein kinase p38; phosphatidylinositol 3 kinase; small interfering RNA; stress activated protein kinase; unclassified drug; virulence factor; Article; cancer therapy; cell migration; controlled study; disease association; gene expression; gene silencing; genetic association; Helicobacter pylori; histone demethylation; histone modification; human; human cell; outcome assessment; priority journal; promoter region; protein depletion; protein interaction; protein targeting; stomach carcinogenesis; transcription initiation; type IV secretion system; upregulation"
"Androgen deprivation-induced ZBTB46-PTGS1 signaling promotes neuroendocrine differentiation of prostate cancer",2019,"Androgen receptor (AR) targeting is an important therapeutic strategy for treating prostate cancer. Most tumors progress to castration-resistant prostate cancer (CRPC) and develop the neuroendocrine (NE) phenotype under androgen deprivation therapy (ADT). The molecular basis for NE transdifferentiation after ADT remains incompletely understood. Herein, we show that an immunocyte expression protein, ZBTB46, induces inflammatory response gene expression and contributes to NE differentiation of prostate cancer cells. We demonstrated a molecular mechanism whereby ZBTB46 can be regulated by the androgen-responsive gene, SPDEF, and is associated with NE prostate cancer (NEPC) differentiation. In addition, ZBTB46 acts as a transcriptional coactivator that binds to the promoter of prostaglandin-endoperoxide synthase 1 (PTGS1) and transcriptionally regulated PTGS1 levels. Overexpression of ZBTB46 decreases the sensitivity of the combination of enzalutamide and a PTGS1 inhibitor; however, knockdown of ZBTB46 sensitizes the PTGS1 inhibitor and reduces tumor malignancy. ZBTB46 is inversely correlated with SPDEF and is increased in higher tumor grades and small-cell NE prostate cancer (SCNC) patients, which are positively associated with PTGS1. Our findings suggest that the induction of ZBTB46 results in increased PTGS1 expression, which is associated with NEPC progression and linked to the dysregulation of the AR-SPDEF pathway. ? 2018 Elsevier B.V.","membrane protein; prostaglandin endoperoxide synthase 1; unclassified drug; androgen receptor; androgen receptor antagonist; AR protein, human; cyclooxygenase 1; PTGS1 protein, human; SPDEF protein, human; transcription factor; transcription factor Ets; Zbtb46 protein, human; analysis of variance; androgen deprivation therapy; animal cell; animal experiment; animal model; animal tissue; Article; binding affinity; carcinogenicity; cell differentiation; chromatin immunoprecipitation; colony formation; controlled study; cytokine production; human; human cell; human tissue; male; mouse; nonhuman; priority journal; promoter region; prostate cancer; protein binding; protein expression; signal transduction; tissue microarray; transcription regulation; ZBTB46 PTGS1 signaling; animal; biosynthesis; cell differentiation; genetics; metabolism; neuroendocrine tumor; nude mouse; pathology; prostate tumor; signal transduction; tumor cell line; Androgen Receptor Antagonists; Animals; Cell Differentiation; Cell Line, Tumor; Cyclooxygenase 1; Humans; Male; Mice; Mice, Nude; Neuroendocrine Tumors; Prostatic Neoplasms; Proto-Oncogene Proteins c-ets; Receptors, Androgen; Signal Transduction; Transcription Factors"
"Knowledge of medications among patients with glaucoma in Taiwan",2019,"Background/Purpose: To investigate the knowledge and learning ability of glaucoma patients regarding their anti-glaucoma topical medications. Methods: Patients on regular follow-up at the Glaucoma Clinic at Hsin-Chu General Hospital were recruited. After detailed ocular examinations, the participants were asked to recall and identify their glaucoma eye drops. The same test was repeated 3 months later. The results of both tests, the learning ability of patients regarding their glaucoma drugs, and the relationship between learning ability and demographic variables were evaluated. Results: Two hundred eighty-seven glaucoma patients participated in this study. Of the study population, 25.8% and 57.1% could recall their topical mediation at the first and second tests, whereas 72.1% and 88.5% could identify their prescribed eye drops at the first and second tests, respectively. Approximately 34% of the participants showed improved knowledge at the repeat test, whereas 40% of the participants showed no improvement. Participants with a better learning ability were more likely to be younger, with a higher level of education, and with less visual field impairment. Conclusion: The knowledge of glaucoma patients regarding their prescribed medication was deficient in Taiwan. Physician effort could improve knowledge on the prescribed drugs. Patient-centered education should be considered, targeting elderly individuals, illiterate individuals, and those with loss of visual function to increase compliance with glaucoma medication. ? 2018","antiglaucoma agent; eye drops; eye drops; adolescent; adult; aged; Article; best corrected visual acuity; color vision; educational status; eye examination; female; glaucoma; high school; human; intraocular pressure; knowledge; learning; major clinical study; male; prescription; primary school; Taiwan; topical treatment; visual acuity; visual field defect; attitude to health; drug monitoring; glaucoma; medication compliance; middle aged; prospective study; questionnaire; statistical model; statistics and numerical data; Adult; Aged; Drug Monitoring; Female; Glaucoma; Health Knowledge, Attitudes, Practice; Humans; Intraocular Pressure; Logistic Models; Male; Medication Adherence; Middle Aged; Ophthalmic Solutions; Prospective Studies; Surveys and Questionnaires; Taiwan"
"Casein-Coated Iron Oxide Nanoparticles for in vitro Hyperthermia for Cancer Therapy",2019,"Iron oxide nanoparticles (NPs) have been a very appealing choice in magnetic-mediated hyperthermia for cancer therapy. The responses of NPs to hyperthermia as a cancer treatment method are complex and variable. Herein, the heating properties of the casein-coated magnetic NPs (MNPs) under an alternating magnetic field were investigated. The casein-coated MNPs were synthesized via one-pot chemical method. The casein-coated MNPs were characterized using transmission electron microscopy (TEM), scanning electron microscopy (SEM), energy dispersive X-ray spectroscopy (EDAX), Fourier transform infrared spectroscopy (FTIR), X-ray diffraction (XRD), zeta potential, dynamic light scattering (DLS), and vibrating sample magnetometer (VSM) analysis. TEM images of casein-coated MNPs show that their shapes are spherical and their core sizes are between 20nm and 25nm. The FTIR and EDAX results confirmed the presence of casein on the surface of MNPs. The VSM shows the superparamagnetic nature of iron oxide and casein-coated iron oxide NPs with the magnetic saturation of 60emu/g and 44.86emu/g, respectively, at room temperature. Furthermore, hyperthermia tests for casein-coated MNPs with various concentrations and frequencies are performed. Hyperthermia results show that lower concentrations of casein-coated MNPs dispatch higher heating into their surrounding medium, whereas maximum specific absorption rate occurs at the concentration of 1mg/mL for the frequency of 150kHz. Findings of this study suggest that casein-coated MNPs have great potential as an anticancer agent in hyperthermia cancer therapy. ? 2019 World Scientific Publishing Company.",""
"Heart Rhythm Complexity Impairment in Patients with Pulmonary Hypertension",2019,"Pulmonary hypertension is a fatal disease, however reliable prognostic tools are lacking. Heart rhythm complexity analysis is derived from non-linear heart rate variability (HRV) analysis and has shown excellent performance in predicting clinical outcomes in several cardiovascular diseases. However, heart rhythm complexity has not previously been studied in pulmonary hypertension patients. We prospectively analyzed 57 patients with pulmonary hypertension (31 with pulmonary arterial hypertension and 26 with chronic thromboembolic pulmonary hypertension) and compared them to 57 age- and sex-matched control subjects. Heart rhythm complexity including detrended fluctuation analysis (DFA) and multiscale entropy (MSE) and linear HRV parameters were analyzed. The patients with pulmonary hypertension had significantly lower mean RR, SDRR, pNN20, VLF, LF, LF/HF ratio, DFAα1, MSE slope 5, scale 5, area 1–5 and area 6–20 compared to the controls. Receiver operating characteristic curve analysis showed that heart rhythm complexity parameters were better than traditional HRV parameters to predict pulmonary hypertension. Among all parameters, scale 5 had the greatest power to differentiate the pulmonary hypertension patients from controls (AUC: 0.845, P &lt; 0.001). Furthermore, adding heart rhythm complexity parameters significantly improved the discriminatory power of the traditional HRV parameters in both net reclassification improvement and integrated discrimination improvement models. In conclusion, the patients with pulmonary hypertension had worse heart rhythm complexity. MSE parameters, especially scale 5, had excellent single discriminatory power to predict whether or not patients had pulmonary hypertension. ? 2019, The Author(s).",""
"Demography and welfare status of free-roaming dogs in Yangmingshan National Park, Taiwan",2019,"Free-roaming dogs (Canis familiaris) cause threats to native wildlife and public health and raise concerns for their welfare. Understanding the demography of free-roaming dog populations is essential for developing an effective management plan. An evaluation of their welfare status would be beneficial to earn public support for the management plan. In this study, we estimated the population size, survivorship, and health of a free-roaming dog population in Yangmingshan National Park (YMSNP), Taiwan, during 2016–2018. YMSNP is a rural area with human settlements but also a protected area of conservation concern. We identified 191, 176, 216 individuals at our sampling sites in 2016, 2017, and 2018, respectively. Using a photographic capture-recapture method and extrapolation, we estimated that there were 786–979 dogs in the park during this 3-year period. The annual apparent survival rate of identified dogs was 16.7% for 2016–2017 and 23.9% for 2017–2018. The dogs had a high rate of lameness and dermatosis of 5.1–8.8% and 14.2–18.1%, respectively. Thirty-five blood samples showed that 34.3% of the dogs were anemic, 37.1% showed abnormal white blood cell counts, and 68.6% exhibited abnormal platelet counts. These results suggested that the dogs were at high density with low survivorship and in poor health, and new individuals entered the population continuously. Interventions to manage this dog population and to improve their welfare must be carried out. Our study provides an example for monitoring and managing a free-roaming dog population in a rural, conservation area in Southeast Asia. ? 2019 Elsevier B.V.","hemoglobin variant; animal health; animal lameness; animal welfare; Article; blood cell count; blood sampling; demography; dog disease; erythrocyte count; female; leukocyte count; male; national park; nonhuman; platelet count; population density; population size; priority journal; public health; rural area; skin disease; stray dog; survival rate; Taiwan; wildlife; wound; animal; dog; physiology; recreational park; Animal Welfare; Animals; Dogs; Female; Male; Parks, Recreational; Population Density; Taiwan"
